idAbt,idBuy,id_abt,name_abt,description_abt,price_abt,id_buy,name_buy,description_buy,manufacturer,price_buy,is_match
580,202812620,580,Bose Acoustimass 5 Series III Speaker System - AM53BK,Bose Acoustimass 5 Series III Speaker System - AM53BK/ 2 Dual Cube Speakers With Two 2-1/2' Wide-range Drivers In Each Speaker/ Powerful Bass Module With Two 5-1/2' Woofers/ 200 Watts Max Power/ Black Finish,$399.00,202812620,Bose Acoustimass 5 Series III Speaker System - 21725,2.1-channel - Black,BOSE,$359.00,1
24789,203017911,24789,Terk Mini Tuner Cartridge For XM Ready Home Products - CNP2000,Terk Mini Tuner Cartridge For XM Ready Home Products - CNP2000/ Connects To Any Home Or Portable Audio Product With The XM Ready Logo,$29.00,203017911,Audiovox CNP2000 XM Mini-Tuner,XM Satellite Radio Receiver,Audiovox,,1
25111,203017912,25111,Terk Mini Tuner Home Dock For XM Ready Home Products - Black Finish - CNP2000H,"Terk Mini Tuner Home Dock For XM Ready Home Products - CNP2000H/ Comes Complete With The Docking Station, Protective Cover And A Window Sill Mount Antenna/ Interfaces To Existing And Future XM Ready Products",$30.00,203017912,Audiovox CNP2000H XM Mini-Tuner Home Dock,XM Satellite Radio,Audiovox,$24.74,1
24921,203340806,24921,Sony DSCH2 Soft Carrying Camera Case - Black Finish - LCSCSH,Sony DSCH2 Soft Carrying Black Camera Case - LCSCSH/ Polypropylene Construction/ Extra Compartments For Accessory Storage/ Can Hold Many Sony Or Other Manufacturers Digital Cameras/ Black Finish,,203340806,Sony LCS-CSH Soft Camera Case - LCSCSH,Top Loading - Polypropylene - Black,Sony,,1
25732,203341506,25732,Olympus Premium Slim Leather Case In Black - 202087,Olympus 202087-410 Premium Slim Leather Case In Black - 202087/ Slim Classic Leather Saddle Bag Design/ Magnetic Closure Clasp/ Leather Wrist Strap/ Interior Pocket/ Compatible With FE200 And FE230/ Black Finish,,203341506,Olympus Slim Leather Case - 202087,Leather - Black,Olympus,$18.99,1
27391,204791643,27391,Kenwood KCA-IP300V iPod Video Direct Cable - KCAIP300V,"Kenwood KCA-IP300V iPod Video Direct Cable - KCAIP300V/ iPod Video Direct Cable For DNX7100, DDX7019 And KVT719DVD Indash Monitors",$49.99,204791643,Kenwood iPod-Video Direct Adapter - KCAiP300V,"Proprietary Male to Type A Male USB, 2 x Mini-phone Male - 4.92ft",Kenwood,$26.00,1
30591,204849801,30591,Audiovox XpressEZ XM Satellite Radio Receiver - XMCK5P,Audiovox XpressEZ XM Satellite Radio Receiver - XMCK5P/ 10 Programmable Channels/ Universal Connector/ 3-Line Screen Display/ Plug & Play Dock/ Black Finish,$69.99,204849801,Audiovox XMCK5P EXPRESSEZ Satellite Radio - XMCK5P,Audiovox Xpress EZ XM Radio Receiver with Vehicle Kit,Audiovox,,1
30593,204860316,30593,Audiovox XpressR XM Satellite Radio Receiver - XMCK20P,Audiovox XpressR XM Satellite Radio Receiver - XMCK20P/ 6 Line Display/ Split Screen For Up To 5 Channels Simultaneously/ Customizable Sports Ticker Feature/ GameSelect And TuneSelect Features/ Universal Connector/ Pause And Replay/ Plug & Play Dock/ Sleep Mode/ Black Finish,,204860316,Audiovox Xpress R XM Radio Receiver with Vehicle Kit XMCK20P,,Audiovox,$76.42,1
28059,205592435,28059,Sony LCS-TWA/R Red Soft Leather Carrying Case - LCSTWAR,Sony LCS-TWA/R Red Soft Leather Carrying Case - LCSTWAR/ Genuine Leather Construction/ Compatible With Cyber-Shot W And T Series Digital Cameras/ Integrated Belt Loop And Magnetic Closure/ Red Finish,,205592435,Sony LCS-TWA/R Cyber-shot Camera Case,Top Loading - Leather - Red,Sony,$27.92,1
28225,205592439,28225,Sony LCS-TWA/B Black Soft Leather Carrying Case - LCSTWAB,Sony LCS-TWA/B Black Soft Leather Carrying Case - LCSTWAB/ Genuine Leather Construction/ Compatible With Cyber-Shot W And T Series Digital Cameras/ Integrated Belt Loop And Magnetic Closure/ Black Finish,,205592439,Sony LCS-TWA/B Cyber-shot Camera Case - LCSTWA/B,Top Loading - Leather - Black,Sony,$34.00,1
31176,205844279,31176,Sony White Cybershot T Series Digital Camera Jacket Case With Stylus - LCJTHCW,Sony White Cybershot T Series Digital Camera Jacket Case With Stylus - LCJTHCW/ For 2007 Cybershot T Series Camera/ Stylus Included/ Custom-Fitted/ White Finish,,205844279,Sony LCJ-THC/B Jacket Case with Stylus - LCJ-THC/W,Leather - White,Sony,$35.08,1
27778,205844282,27778,Sony LCS-CSJ Black Soft Carrying Case - LCSCSJ,"Sony LCS-CSJ Black Soft Carrying Case - LCSCSJ/ Compatible With S, W, T, And N Series Digital Cameras/ Durable Nylon Construction/ Convenient Front Pocket/ Black Finish",,205844282,Sony LCS-CSJ Soft Camera Case - LCSCSJ,Top Loading - Polyamide - Black,Sony,,1
38098,203341506,38098,Toshiba 40' Black Flat Panel LCD HDTV - 40RV525U,Toshiba 40' Black Flat Panel LCD HDTV - 40RV525U/ 1080p Full HD (1920 x 1080) CineSpeed Display/ DynaLight Dynamic Backlight Control/ NTSC/ATSC/QAM Built-In Tuners/ 10-Bit Video Processor/ 60Hz Video Scan Rate/ 3:2 Pull-Down Cinema Mode 24fps/ Color Temperature Control/ Black Finish,,203341506,Olympus Slim Leather Case - 202087,Leather - Black,Olympus,$18.99,0
35525,206870289,35525,Panasonic Black Expandable Digital Cordless Dect 6.0 Phone System - KXTG9348T,Panasonic Black Expandable Digital Cordless Dect 6.0 Phone System - KXTG9348T/ Automatic Clarity Booster/ 5 Hours Talk Time/ 11 Days Standby/ White Backlit LCD/ 6-Step Speakerphone Volume/ 1 Drop & Splash Resistant Phone/ 1.9GHz Frequency Range/ Night Mode/ Black Finish,,206870289,Transcend 16GB SDHC Card & Compact Card Reader S5 - TS16GSDHC6-S5W,,TRANSCEND INFORMATION,,0
30158,206639246,30158,LaCie 1TB FireWire 800/FireWire 400/USB 2.0 External Hard Drive - 301199U,LaCie 1TB FireWire 800/FireWire 400/USB 2.0 External Hard Drive - 301199U/ Triple Interface For Universal Connectivity On PC/Mac/ Built-In RAID 0 For Extreme FireWire 800 Speed/ 7200 Rotational Speed (rpm)/ Thermo-Regulated Progressive Quiet Fan,,206639246,DELONGHI DCF212T 12-Cup Drip Coffee Maker,,DeLonghi,$49.99,0
27479,208456203,27479,Tripp-Lite PV375 PowerVerter 375-Watt Ultra-Compact Inverter - PV375,Tripp-Lite PV375 PowerVerter 375-Watt Ultra-Compact Inverter - PV375/ 12V DC Input/ 120V AC Output/ 2 Outlets/ 375 Watts Continuous Output/ 600 Watts Peak Output/ Convenient Cigarette Lighter Plug,$49.00,208456203,Whirlpool DU1055XTSS 6' Console Undercounter Dishwasher (Stainless Steel),,Whirlpool,$359.00,0
36264,204465488,36264,iHome Silver Computer Speakers With iPod Dock - IH70S,"iHome iH70SRC Silver Computer Speakers With iPod Dock - IH70S/ 15 Watts/ Sync iPod With Computer/ Reson8 Speakers/ Full Function Remote Control/ Charge iPod While Docking/ Compatible With iPod Touch, iPod Classic, iPod 4th Generation And Up, iPod Nano 1st Generation And Up/ Silver With Black Trim Finish",,204465488,GN Jabra BT5010 Wireless Earset,Jabra BT5010 Bluetooth Headset,Jabra,$26.37,0
38500,208456262,38500,DLO Black HybridShell For iPhone 3G - DLA4010717,"DLO Black HybridShell For iPhone 3G - DLA4010717/ Fusion Of Crystal-Clear Polycarbonate Hard-Shell Case Plus Non-Slip Silicone Accents/ Custom Fit/ Ultra-Slim Scratch And Slip Protection/ Total Access To All Controls, Dock Connector And Headset Jack/ Designed Especially For The iPhone 3G/ Surface Shield Included/ Black Finish",$24.99,208456262,Whirlpool WTW6700TU Cabrio 4.6 Cu. Ft. Top Load Washer (Diamond Dust),,Whirlpool,"$1,029.75",0
35186,208114672,35186,LG 24' LDF6920ST Fully Integrated Built In Stainless Steel Dishwasher - LDF6920SS,LG 24' LDF6920ST Fully Integrated Built In Stainless Steel Dishwasher - LDF6920SS/ XL Tall Tub Cleans Up To 16 Place Settings At Once/ Adjustable Upper Rack/ LoDecibel Quiet Operation/ SenseClean Wash System/ 5 Wash Cycles With 3 Spray Arms/ Multi-Level Water Direction/ Slim Direct Drive Motor/ Fully Integrated Electronic Control Panel/ Stainless Steel Finish,,208114672,LG 25.0 Cu.Ft. Total Capacity,,LG Electronics,,0
25550,208114672,25550,Sanus 15' To 40' Flat Panel Black TV Wall Mount - ML22B1,Sanus 15' To 40' Flat Panel Black TV Wall Mount - ML22B1/ Solid Heavy-Gauge Steel Construction/ Durable Powder-Coated Finish/ Fits Most Medium Flat Panel LCD TVs Up To 100 Lbs/ Black Finish,,208114672,LG 25.0 Cu.Ft. Total Capacity,,LG Electronics,,0
33662,209253738,33662,Bracketron Nav-Mat Portable GPS Dash Mount - UFM100BL,Bracketron Nav-Mat Portable GPS Dash Mount - UFM100BL/ Weighted Anti-Skid Base/ Conforms To Your Dash/ Holds Up To Several Pounds/ Easily View Your GPS While Drivaing/ Uses The Stock GPS Windshield Mount,,209253738,Canon VIXIA HG20 High Definition Camcorder - 3085B001AA,,Canon,$557.64,0
37120,207900179,37120,Canon PowerShot Black Digital Camera - SX110ISB,Canon PowerShot SX110 IS Black Digital Camera - SX110ISB/ 9.0 Megapixel/ 10x Optical Zoom Lens With Optical Image Stabilizer Technology/ 3.0' LCD Display/ DIGIC III Image Processor/ Face Detection/ Motion Detection/ 20 Shooting Modes Including 8 Special Scene Modes/ Red-Eye Correction/ Automatic ISO Settings/ Print-Share Button/ Power By AA Batteries For Convenient/ Black Finish,,207900179,Samsung LN32A550 32' LCD TV,"Samsung LN32A550 - 32' Widescreen 1080p LCD HDTV - 15,000:1 Dynamic Contrast Ratio - 5ms Response Time - Piano Black",Samsung,$849.00,0
38343,90132241,38343,Panasonic DECT 6.0 Pearl Silver Expandable Digital Cordless Phone System - KXTG6313S,Panasonic DECT 6.0 Pearl Silver Expandable Digital Cordless Phone System - KXTG6313S/ 3 Handsets/ Up To 6 Multi-Handset Capability/ DECT 6.0 Technology/ Ringer ID/ Call Waiting Caller ID/ Voicemail/ Hold/ Mute/ Clock/ Alarm/ LED Lighting/ Night Mode/ Speakerphone/ 11 Days Standby/ 5 Hours Talk Time/ Pearl Silver Finish,$69.00,90132241,Sony PS-LX350H Belt-Drive Turntable,,Sony,,0
33443,90141074,33443,Sony 60GB Handycam Hard Disk Drive Camcorder - DCRSR85,Sony 60GB Handycam Hard Disk Drive Camcorder - DCRSR85/ 1/6' Advanced HAD CCD Imager/ 25X Optical/2000X Digital Zoom/ 2.7' Wide (16:9) Touch Panel Clear Photo LCD Plus Display/ Hybrid Recording To Hard Disk Drive Or Memory Stick Media/ Built-In Zoom Microphone With 5.1ch Recording/ Carl Zeiss Vario-Tessar Lens/ USB 2.0 Interface/ Super NightShot Infrared System,,90141074,Panasonic 3x DVD-RAM Media,Panasonic LM-AF120LU5 Rewritable DVD-RAM Disc without Cartridge,Panasonic,,0
34894,204559208,34894,Sony 46' BRAVIA W-Series Black LCD Flat Panel HDTV - KDL46W4100,"Sony 46' BRAVIA W-Series Black LCD Flat Panel HDTV - KDL46W4100/ 1920 x 1080 Full HD Resolution/ DMex/ Motionflow 120Hz Technology/ Advanced Contrast Enhancer (ACE)/ BRAVIA Sync Technology/ 24p True Cinema/ 30,000:1 Dynamic Contrast Ratio/ 3D Comb Filter/ CineMotion Reverse 3:2 Pulldown Technology/ Silver With Black Finish",,204559208,Panasonic NNSD667S 1.2 cu. ft. Countertop Microwave Oven In Stainless Steel,,Panasonic,,0
34638,204226641,34638,Sony White Speaker Dock And Clock Radio For iPod And iPhone - ICFC1IPMK2WHT,Sony ICFC1IPMK2 White Speaker Dock And Clock Radio For iPod And iPhone - ICFC1IPMK2WHT/ Unique Adjustable Backstop For iPods/ 3 Wake-Sleep Sound Alert Options/ Digital AM-FM Tuner/ Alarm Clock/ Automatic Time Set/ Automatic Daylight Savings Time/ Battery Charger/ Audio Input/ White Finish,,204226641,Case Logic Universal Vertical PDA Leather Pouch - CLP104BB,Leather,Case Logic,$9.99,0
17094,208177785,17094,Delonghi Twenty Four Seven Coffee Maker - DC50W,"Delonghi Twenty Four Seven Coffee Maker - DC50W/ 4-Cup Capacity/ Easy-Access, Washable Filter Basket/ White Finish",$22.00,208177785,Boston Acoustics Horizon Duo-i AM/FM Stereo Radio - HDUOIMDNT,"5 x AM, 10 x FM",Boston Acoustics,$135.52,0
38449,208504179,38449,Linksys Dual-Band Wireless-N Gaming Adapter - WGA600N,"Linksys Dual-Band Wireless-N Gaming Adapter - WGA600N/ Lag-Free Head-To-Head Or Internet Gaming/ Converts Wired-Ethernet-Ready Game Consoles To Wireless-N Network Connectivity/ Works Without Drivers On Xbox, Xbox 360, PlayStation2 Or 3 And GameCube/ Dynamically Changes Channels And Radio Bands (2.4 Or 5GHz)/ Works On Any Platform/ Black Finish",$89.00,208504179,Denon DVD-3800BDCI Blu-ray Disc Player - DVD3800BDCI,"BD-R, DVD-RW, CD-RW, Secure Digital (SD) - DVD Video, CD-DA, MP3, WMA, JPEG, DivX 6, PCM Playback - Progressive Scan",Denon,,0
26930,208504422,26930,Monster PS3 HDMI-2M Playstation 3 GameLink HDMI Digital Video/Audio Cable - PS3HDMI2M,Monster PS3 HDMI-2M Playstation 3 GameLink HDMI Digital Video/Audio Cable - PS3HDMI2M/ Duraflex Jacket/ All-In-One Digital AV Cable/ 24k Gold Contacts,,208504422,Mitsubishi Diamond WD-65835 65' Projection TV,65' - DLP,Mitsubishi,"$2,399.00",0
26891,203199121,26891,Garmin 010-10723-03 Nuvi Suction Cup Mount - 0101072303,Garmin 010-10723-03 Nuvi Suction Cup Mount - 0101072303/ Replacement Suction Cup Mount/ Compatible With Garmin Nuvi 300/310/350/360 GPS System/ Black Finish,$39.00,203199121,"Hoover EmPower U5269-900 Vacuum (Upright, HEPA, Bagless)",,Hoover,,0
34349,203017999,34349,Samsung 37' Series 5 LCD Black Flat Panel HDTV - LN37A550,"Samsung 37' Series 5 LCD Black Flat Panel HDTV - LN37A550/ Full 1080p High Definition Resolution/ 16:9 Widescreen Aspect Ratio/ 15,000:1 Dynamic Contrast Ratio/ 5ms Response Time/ SRS TruSurround XT Audio/ Built-In Digital Tuner (ATSC/Clear QAM)/ Picture-In-Picture/ Sound Leveler/ 3 HDMI Slots/ Swivel Stand/ Black Finish",,203017999,Denon TU-1500RD Stereo Radio Tuner - TU1500RD,40,Denon,,0
29816,207391020,29816,Sony HD Radio Add On Tuner - XT100HD,Sony HD Radio Add On Tuner - XT100HD/ High-Fidelity FM/AM Digital Radio With HD Radio Technology/ Compatible With Most 2005 Headunits And Later That Are SAT Radio Ready/ Built-In Sony Bus Connectivity/ Black Finish,,207391020,Panasonic DMR-EA18K DVD Player/Recorder,"DVD+RW, DVD-RW, DVD-RAM, DVD-R, DVD+R, CD-RW, Secure Digital (SD) - DVD Video, CD-DA, MP3, JPEG, DivX, MPEG-2, PCM Playback - Progressive Scan - 14.33Hour Recording",Panasonic,,0
34860,207544265,34860,LG LDC22720ST 22 Cu. Ft. Smooth White Bottom Freezer Refrigerator - LDC22720SS,LG LDC22720ST 22 Cu. Ft. Stainless Steel Bottom Freezer Refrigerator - LDC22720SS/ 4 Split Tempered Glass Shelves/ Upfront Digital Temperature Controls/ 2 Clear Humidity Controlled Crispers/ Multi-Air Flow Cooling/ IcePlus Accelerated Freezing Function/ LoDecibel Quiet Operation/ BioShield Anti-Bacterial Door Seal/ Freezer Drawer/ Stainless Steel Finish,,207544265,DNX5120 All-in-One Navigation/DVD Entertainment System,,Kenwood,$635.00,0
34926,203472622,34926,LG Black Freestanding Electric Range - LRE30757BK,LG Black Freestanding Electric Range - LRE30757BK/ 5.6 Cu. Ft. Capacity/ Dual Convection/ Self-Cleaning/ Touch Controls/ Ceramic Cooktop/ WideView Window/ Warming Drawer/ Interior Oven Light/ Black Finish,,203472622,Panasonic KX-FP145 Plain Paper Thermal Transfer Fax/Copier - KXFP145,Panasonic Slim Cabinet Plain Paper Fax/Copier with All-digital Answering System,Panasonic,$94.88,0
35851,208131008,35851,Linksys Ultra RangePlus Wireless-N Broadband Router - WRT160N,Linksys Ultra RangePlus Wireless-N Broadband Router - WRT160N/ Internet-Sharing Router/ 4-Port Switch/ Enhanced Wireless Access Point/ MIMO Technology/ Faster Than Wireless-G/ Protected By Wireless Encryption/ Powerful SPI Firewall/ 2 Antennas/ Glossy Black Finish,$79.00,208131008,Canon PSC-85 Soft Camera Case - 2595B002,,Canon,$8.77,0
29866,206725964,29866,LG WM2455HG 4.2 Cu Ft Pearl Gray Front Load Washer - WM2455G,LG WM2455HG 4.2 Cu Ft Pearl Gray Front Load Washer - WM2455G/ 4.2 Cu. Ft. Capacity/ Direct Drive Motor/ 1200 RPM Powerful Spin/ SenseClean System/ 9 Washing Programs/ 5 Temperature Levels/ Load Size Sensing Indicator/ RollerJets/ Sanitary Cycle/ Upfront Electronic Control Panel With Dual LED And Dial-A-Cycle/ Pearl Gray Finish,,206725964,Sony ADMSCF1 Sony Memory Stick Duo Adapter for CF,,Sony,,0
29806,210401451,29806,Panasonic White Integrated Telephone System - KXTS600W,Panasonic White Integrated Telephone System - KXTS600W/ Speakerphone/ One-Touch Dialer/ 3-Line LCD/ Data Port/ Wall Mountable/ White Finish,,210401451,Apple MacBook Pro Notebook - MB470LL/A,"Intel Core 2 Duo 2.4GHz - 15.4' WXGA+ - 2GB DDR3 SDRAM - 250GB HDD - DVD-Writer (DVDR/RW) - Gigabit Ethernet, Wi-Fi, Bluetooth - Mac OS X 10.5 Leopard",Apple,"$1,849.00",0
30457,208043057,30457,Sony Black DVD Recorder And VHS Combo Player - RDRVXD655,Sony Black DVD Recorder And VHS Combo Player - RDRVXD655/ Multiformat DVD Compatible/ HDMI Output And 720p/1080i Upscaling/ HDTV Tuner/ 4 Video Head Stereo VHS With 19 Micron Heads/ Variable Bit Rate Recording (7 Speeds)/ Progressive Scan Playback/ Dolby Digital And DTS Decoding Playback Compatible/ TV Virtual Surround/ Black Finish,$319.00,208043057,Nintendo DS Lite (Metallic Rose) - USGSZPB,,Nintendo Of America,,0
38457,207900171,38457,Linksys Dual-Band Wireless-N USB Network Adapter - WUSB600N,"Linksys Dual-Band Wireless-N USB Network Adapter - WUSB600N/ High-Speed Wireless-N (Draft 802.11n) Networking/ MIMO Technology/ Operates In The 2.4 And 5GHz Radio Bands/ Connects To Wireless-G, B And A Networks",$69.00,207900171,Samsung 6 Series HL61A650 61' Projection TV,Samsung HL61A650 - 61' Widescreen 1080p DLP HDTV w/ Built in NTSC/ATSC Tuner - Piano Black,Samsung,"$1,076.94",0
33640,203900792,33640,Toshiba Black DVD Recorder With Built-In Digital Tuner - DR560,Toshiba Black DVD Recorder With Built-In Digital Tuner - DR560/ Built-In ATSC/NTSC/QAM Digital/Analog Tuner/ Multi-Format Recording And Playback/ Video Upconversion Up To 1080p Resolution/ One Touch Recording/ Camcorder Controls/ Auto Finalize With Undo/ REGZA LINK/ Black Finish,,203900792,Techcraft SWP60 Classic Wood Tone Credenza TV Stand,Wood - Walnut,Tech Craft,,0
39175,90145972,39175,Logitech Digital Precision PC Gaming Headset - 981000040,Logitech Digital Precision PC Gaming Headset - 981000040/ Cushioned Open-Air Design/ USB And Analog Connections/ Noise-Canceling Microphone/ In-Line Volume And Mute Controls/ 10 Ft. Cable Length/ PC And Mac Compatible/ Black Finish,$49.00,90145972,Weber 841001 Performer 22.5' Charcoal Grill in Black,,Weber,,0
23537,208117937,23537,Universal RF Series MasterControl Remote Control - RF20,Universal RF Series MasterControl Remote Control ? RF20/ Control Up To 10 Components/ 432 MacroPower Buttons/ Customizable LCD Screen/ Pre-Programmed Codes/ Learning Capable/ SimpleSound/ Fully Backlit Keypad/ DVD Guide,$79.99,208117937,LG 5.0 cu.ft. Freestanding Gas Range,,LG Electronics,,0
24571,204563763,24571,Panasonic 2 Line 5.8 GHz FHSS GigaRange Expandable Digital Cordless Answering System - Black Finish - KXTG6700B,Panasonic 2 Line 5.8 GHz FHSS GigaRange Expandable Digital Cordless Answering System - KXTG6700B/ Expandable Up To 8 Handsets Total/ 4-Line Backlit LCD On Handset/ Voice Enhancer Technology/ Handset Speakerphone/ Clarity Booster/ Room Monitor/ 60 Minutes Of Total Record Time/ Black Finish,,204563763,Sony SLVD380P DVD/VCR Combo,"VHS, DVD-R, CD-R - DVD Video, MP3 Playback - Progressive Scan",Sony,,0
29304,206812380,29304,Haier 13' Silver Tube TV - HTR13,Haier 13' Silver Tube TV - HTR13/ Built-In Atsc/Ntsc Tuner/ Video Noise Reduction/ Multi Picture Modes/ Multilingual Display/ Digital Comb Filter/ Component Video Input/ Front AV Jacks/ Silver Finish,$124.00,206812380,Sharp AQUOS LC37D44U 37' LCD TV - LC37D44U,Sharp AQUOS LC-37D44U - 37' Widescreen LCD HDTV - 7500:1 Dynamic Contrast Ratio - 6ms Response Time,Sharp,,0
34125,209194241,34125,Belkin Cush Top For Computer Laptop - F8N044ORG,"Belkin Cush Top For Computer Laptop - F8N044ORG/ Uniquely Designed Soft Material For Comfortable Laptop Use On The Couch, Bed, Or Floor/ Convenient Storage Pocket Center/ Multi-Sides Accommodate Any Side Laptop/ 6 Colors To Choose From/ Orange Finish",,209194241,"Nikon D90 12 Megapixel Digital SLR Camera w/ 3' LCD, Live View, 4.5 fps Burst & In-Camera Image Editing - Body Only - 25446",,Nikon,$899.95,0
17872,207682339,17872,Sanus 15' - 40' Flat Panel TV Silver Wall Mount - VM400S,Sanus 15' - 40' Flat Panel TV Silver Wall Mount - VM400S/ Virtual Axis Tilt Adjustment System/ Hinged Arm Extend From 3.5' To 20'/ Durable Powder Coated Silver Finish,$219.99,207682339,Speck Products SeeThru Case for Apple MacBook Air - MBA-PNK-SEE,Plastic - Pink,Speck Products,,0
34003,201699873,34003,Samsung 40' Series 5 LCD Black Flat Panel HDTV - LN40A550,"Samsung 40' Series 5 LCD Black Flat Panel HDTV - LN40A550/ Full 1080p High Definition Resolution/ 16:9 Widescreen Aspect Ratio/ 30,000:1 Dynamic Contrast Ratio/ 5ms Response Time/ SRS TruSurround XT Audio/ Built-In Digital Tuner (ATSC/Clear QAM)/ Picture-In-Picture/ Sound Leveler/ 3 HDMI Slots/ Swivel Stand/ Black Finish",,201699873,Peerless Universal Flat Wall Mount - SF640P,Peerless Flat Wall Mount for 23'- 46' LCD Screens - Black,Peerless,,0
36909,202592699,36909,Olympus Silver 8 Megapixel Digital Camera - FE370S,Olympus Silver 8 Megapixel Digital Camera - FE370S/ Dual Image Stabilization/ 5x Optical Zoom/ Face Detection/ Intelligent Auto/ Smile Shot/ 2.7' High Resolution LCD/ 18 Shooting Modes/ 8.0 Megapixels/ Silver Finish,,202592699,Directed Electronics Antenna Extension Cable - 14230,SMB - 50ft,Sirius,,0
25814,206725198,25814,Tech Craft Avalon Series TV Stand - SWP48,Tech Craft Avalon Series TV Stand - SWP48/ 48' Wide Credenza For Flat Panel TVs And DLPs/ 260 Lbs TV Weight Capacity/ 50 Lbs Shelf Weight Capacity/ Wood Veneer Finish,$299.00,206725198,Cuisinart TOB-195 Cuisinart Exact Heat Convection Toaster Oven Broiler - TOB195,,Cuisinart,$178.99,0
37287,203491687,37287,Toshiba 32' Black LCD Flat Panel HDTV - 32AV502U,Toshiba 32' Black LCD Flat Panel HDTV - 32AV502U/ 720p (1366 x 768) HD CineSpeed Display/ DynaLight Dynamic Backlight Control/ NTSC/ATSC/QAM Digital Tuner/ 10 Bit Video Processor/ 60Hz Video Scan Rate/ Color Temperature Control/ Auto Aspect Control/ Black Finish,,203491687,Waring Pro Deep Fryer 3qt -Black,,Waring,,0
30593,205557530,30593,Audiovox XpressR XM Satellite Radio Receiver - XMCK20P,Audiovox XpressR XM Satellite Radio Receiver - XMCK20P/ 6 Line Display/ Split Screen For Up To 5 Channels Simultaneously/ Customizable Sports Ticker Feature/ GameSelect And TuneSelect Features/ Universal Connector/ Pause And Replay/ Plug & Play Dock/ Sleep Mode/ Black Finish,,205557530,Canon PIXMA MX310 Multifunction Photo Printer - 2184B002,"Canon PIXMA MX310 Office All-in-One Printer, Scanner, Copier and Fax with High-Speed Auto Document Feeder",Canon,$89.99,0
35467,207937987,35467,Peerless 23' - 46' Universal Flat Panel TV Black Wall Mount - SF640P,Peerless 23' - 46' Universal Flat Panel TV Black Wall Mount - SF640P/ Supports Up To 150 Lbs/ Open Wall Plate Design/ Ultra-Slim Design Holds Screen Only 1.2' From The Wall/ Black Finish,,207937987,Nikon Coolpix P80 Digital Camera - 26114,"Nikon COOLPIX P80 10 Megapixel Digital Camera with 18x Optical Wide-Angle Zoom, 2.7' High-Resolution LCD, Vibration Reduction Image Stabiliation & up to an ISO6400",Nikon,$271.72,0
26137,206356234,26137,Panasonic SR-NA18 White Deluxe Fuzzy Logic Rice Cooker - SRNA18,Panasonic SR-NA18 White Deluxe Fuzzy Logic Rice Cooker - SRNA18/ Compact Design/ Advanced Fuzzy Logic Technology/ 8 Menu Settings/ Non-Stick Coated Pan With Dimpled Bottom/ 24-Hour Clock/ 12-Hour Keep Warm Feature/ White Finish,,206356234,SIRIUS SRH1000 Polk Audio Designs? Dual Zone Home Tuner,,Sirius,,0
35216,202537952,35216,Samsung Black Blu-ray Player - BDP1500,"Samsung Black Blu-ray Player - BDP1500/ 1080p With 24Hz Video Output/ x.v.Color Connectivity (HDMI v1.3 Option)/ Selectable DVD Upconversion (720p/1080i/1080p)/ Anynet+ (HDMI-CEC)/ Dolby Digital, Dolby Digital Plus, Dolby TrueHD And DTS-HD Master Audio/ Ethernet Port/ Black Finish",,202537952,Panasonic KX-TGA450B Cordless Handset,Panasonic KX-TGA450B Additional Handset for PANKXTG4500B,Panasonic,,0
37872,210442348,37872,Apple MacBook 2.4GHz Intel Core 2 Duo Silver Notebook Computer - MB467LLA,Apple MacBook 2.4GHz Intel Core 2 Duo Silver Notebook Computer - MB467LLA/ 2.4GHz Intel Core 2 Duo Processor/ 250GB 5400-RPM Serial ATA Hard Drive/ 13' LED-Backlit Glossy Widescreen Display/ Built-In iSight Camera/ Built-In AirPort Extreme Wi-Fi And Bluetooth/ NVIDIA GeForce 9400M Graphics Processor/ Extended Desktop And Video Mirroring/ Multi-Touch Trackpad/ 60W MagSafe Power Adapter/ Mini DisplayPort/ Mac OS X v10.5 Leopard/ Silver Finish,"$1,599.00",210442348,Sony BRAVIA XBR Series KDL-46XBR6 46' LCD TV - KDL46XBR6,"46' - Active Matrix TFT - ATSC, NTSC - 16:9 - 1920 x 1080 - Dolby, Surround - HDTV - 480i, 480p, 720p, 1080i, 1080p",Sony,"$1,977.72",0
21268,207391018,21268,Garmin StreetPilot C330 Dash Mount - Black Finish - 0101061300,Garmin StreetPilot C330 Dash Mount - 0101061300/ Non-Skid Mount Design/ Fully Portable/ Includes 12/24 Volt Cigarette Lighter Adapter/ Black Finish,$57.00,207391018,Panasonic DVD-LS83 Portable DVD Player,"8.5' LCD - DVD+RW, DVD-RW, DVD-RAM, DVD+R, DVD-R, CD-RW - DVD Video, CD-DA, MP3, JPEG, MPEG-4, DivX, WMA, Video CD, SVCD, HighMAT Playback",Panasonic,$148.69,0
35475,203017911,35475,Sony DVD Recorder In Black - RDRGX360,Sony DVD Recorder In Black - RDRGX360/ 1080p/1080i/720p Upscaling For DVD/ USB One Touch Dubbing/ Line Input Recording/ BRAVIA Sync/ DVD+R Double Layer Recording/ Dolby Digital Decoding Playback Compatible/ Black Finish,$179.00,203017911,Audiovox CNP2000 XM Mini-Tuner,XM Satellite Radio Receiver,Audiovox,,0
34747,90049795,34747,Canon BCI-6 Multipack Ink Tanks - 4705A018,"Canon BCI-6 Multipack Ink Tanks - 4705A018/ Includes 1 Black, 1 Magneta, 1 Light Magenta, 1 Cyan, 1 Light Cyan, And 1 Yellow Cartridge/ BCI-6 Color Inkjet Cartridge/ For Canon i9900 & Pixma iP8500 Series Printers",,90049795,Sony MiniDV Head Cleaner - DVM12CLD,Head Cleaner,Sony,$7.95,0
