idAbt,idBuy,id_abt,name_abt,description_abt,price_abt,id_buy,name_buy,description_buy,manufacturer,price_buy,is_match
35282,207937987,35282,Nikon COOLPIX P80 Digital Camera In Black - COOLPIXP80,Nikon COOLPIX P80 Digital Camera In Black - COOLPIXP80/ 10.1 Megapixels/ 18x Optical Wide-Angle Zoom-NIKKOR Lens / 2.7' High-Resolution LCD/ Electronic Viewfinder/ Auto Adjusts Up To ISO 6400/ In-Camera Red-Eye Fix/ Face-Priority AF/ D-Lighting/ High Quality TV Movies With Sound/ Black Finish,,207937987,Nikon Coolpix P80 Digital Camera - 26114,"Nikon COOLPIX P80 10 Megapixel Digital Camera with 18x Optical Wide-Angle Zoom, 2.7' High-Resolution LCD, Vibration Reduction Image Stabiliation & up to an ISO6400",Nikon,$271.72,1
34657,207938488,34657,Samsung 40' Series 7 LCD Black Flat Panel HDTV - LN40A750,"Samsung 40' Series 7 LCD Black Flat Panel HDTV - LN40A750/ Touch Of Color Design/ Full 1080p High Definition Resolution/ 16:9 Widescreen Aspect Ratio/ 50,000:1 Dynamic Contrast Ratio/ 4ms Response Time/ SRS TruSurround XT Audio/ Built-In Digital Tuner (ATSC/Clear QAM)/ Picture-In-Picture/ 4 HDMI Connections (3 Rear/1 Side)/ Black With Red Accent Finish",,207938488,"Samsung LN40A750 - 40' 1080p LCD HDTV - 50,000:1 Dynamic Contrast Ratio - 4ms Response Time - 120Hz",,Samsung,"$1,341.12",1
34286,207945552,34286,Omnimount Moda Collection Series Dark Espresso TV Stand - ECHO50,Omnimount Moda Collection Series Dark Espresso TV Stand - ECHO50/ Accommodates Up To 50' Flat Panels And DLPs/ Components Shelf/ Cable Management System/ Rubberized Feet/ Dark Espresso Finish,,207945552,OmniMount Moda Collection Echo 50 TV Stand - ECHO 50,OmniMount Echo 50 Moda Collection TV Table Stand for up to 50' TVs - Espresso,"OMNIMOUNT SYSTEMS, INC",,1
34076,207959750,34076,Onkyo 7.1-Channel Black Home Theater Receiver - TXSR506B,Onkyo TXSR506 7.1-Channel Black Home Theater Receiver - TXSR506B/ High-Definition Media Capability/ 3 HDMI Inputs/ Audyssey 2EQ And Audyssey Dynamic EQ Sound Correction Technologies/ Advanced 32-Bit Processing DSP Chip/ 4 Digital Inputs/ Support Compressed Digital Music Files/ Double Bass Function/ 40 FM-AM Radio Presets/ iPod Compatible/ Black Finish,,207959750,Onkyo TXSR506 A/V Receiver,"Dolby Digital, Dolby Pro Logic IIx, Dolby Digital EX, DTS, DTS-ES, DTS 96/24, DTS Neo:6FM, AM",Onkyo,$227.72,1
34770,207959798,34770,Samsung 52' Series 7 Black Flat Panel LCD HDTV - LN52A750,"Samsung 52' Series 7 Black Flat Panel LCD HDTV - LN52A750/ 1920 x 1080 Full HD Resolution/ 50,000:1 Dynamic Contrast Ratio/ 4ms Response Time/ SRS Trusurround XT/ Touch Of Color Design/ Auto Motion Plus 120Hz/ Ultra Clear Panel/ Pre-Loaded Content/ Black Finish",,207959798,"Samsung LN52A750 - 52' 1080P LCD HDTV - 50,000:1 Dynamic Contrast Ratio - 120Hz - 6ms Response Time",,Samsung,"$2,148.99",1
34899,207959814,34899,Sony Black 9 Megapixel Cyber-Shot Digital Camera - DSCH50B,Sony Black 9 Megapixel Cyber-Shot Digital Camera - DSCH50B/ 9 Megapixels/ 3.0' Tilt-Up Clear Photo LCD Plus Display/ Carl Zeiss 15X Optical Zoom Lens/ 15 MB Internal Memory/ Versatile Long Distance Flash/ Smart Zoom/ In-Camera Red-Eye Correction/ Smile Shutter Technology/ Face Detection/ In-Camera Retouching/ Super SteadyShot Optical Image Stabilization/ Double Anti-Blur Solution/ HDTV Compatibility/ NightShot Infrared System/ Black Finish,,207959814,Sony Cyber-shot DSC-H50 Digital Camera - Black - DSCH50B,9.1 Megapixel - 16:9 - 2x Digital Zoom - 3' Active Matrix TFT Color LCD,Sony,$329.00,1
34966,207965387,34966,Samsung MiniDV Digital Camcorder - SCDC382,Samsung MiniDV Digital Camcorder - SCDC382/ 680K Pixel CCD/ 34X Zoom Lens/ 720 x 480 Pixel Movie Resolution/ Digital Image Stabilizer/ 23 Language Options/ 80 Minute Battery Life,,207965387,Samsung SC-D382 Digital Camcorder,Samsung SC-D382 Mini DV Camcorder,Samsung,$128.96,1
34496,207978102,34496,Samsung Sound Bar Home Theater System - HTX810,Samsung HTX810T Sound Bar Home Theater System - HTX810/ 300 Watts/ 2.1 Channel Dolby Digital And DTS/ 5.1 Virtual Surround Sound/ Built-In 1080p Upconverting DVD Player/ Wireless Subwoofer/ USB Host Play/ Bluetooth Capable/ Smart Volume/ Wall Mountable/ Black Finish,,207978102,Samsung HTX810T Home Theater System - HTX810T,Samsung HT-X810 2.1 Soundbar Home Theater System,Samsung,$580.14,1
38733,207979206,38733,Kensington Mini Battery Pack And Charger For iPhone And iPod - K33442US,"Kensington Mini Battery Pack And Charger For iPhone And iPod - K33442US/ Includes Retractable USB Charging Cable/ High-Capacity, Rechargeable Lithium-Ion Polymer Battery Pack/ LED Battery Meter/ Cap Converts Into A Kickstand/ Black Finish",,207979206,Kensington Mini Battery Pack and Charger for iPhone and iPod - K33442US,,Kensington,,1
35045,207986331,35045,Samsung Black Combo DVD/VHS Player - DVDV9800,Samsung Black Combo DVD/VHS Player - DVDV9800/ Progressive Scan/ 1080p Up-Conversion Via HDMI/ 10Bit / 54MHz Digital-To-Analog Converter/ 4-Head Hi-Fi VCR/ Black Finish/ No Tuner,$98.00,207986331,Samsung DVD-V9800 DVD/VCR Combo Player w/ 1080p Up-Conversion,,Samsung,$85.06,1
33726,207993409,33726,Boston Acoustics Solo AM/FM Large Display Clock Radio - HSOLOMDNT,Boston Acoustics Solo AM/FM Large Display Clock Radio - HSOLOMDNT/ Rotating Clock Face/ Precision Tuner/ 3 1/2? Full-Range Speaker/ Auxiliary Input/ High Contrast LCD Display/ 360º Snooze Bar/ Grey Finish,$99.00,207993409,Boston Acoustics Horizon Solo AM/FM Radio - HSOLOMNDT,,Boston Acoustics,$90.00,1
30159,208033486,30159,Alpine CD/MP3/WMA/AAC Receiver - CDA9887,Alpine CD/MP3/WMA/AAC Receiver - CDA9887/ 50W x 4 High Power Amplifier/ 24-Bit DAC/ Detachable Face Plate/ Bluetooth Ready/ Rotary Encoder Knob/ 2 Line Biolite Display/ Steering Wheel Control Ready/ IMPRINT Technology/ Full Speed Connection For iPod/ iPhone Compatible,,208033486,ALPINE CDA-9887 Car Audio Player - CDA9887,"CD-R, CD-RW - CD-DA, MP3, WMA, AAC - 4 - 200W - FM, AM",Alpine,$295.00,1
34815,208033806,34815,Pioneer Black Premier Single CD Receiver - DEHP700BT,Pioneer Black Premier Single CD Receiver - DEHP700BT/ Built-In Bluetooth Solution/ USB Direct Control For iPod/ Advanced Sound Retriever/ 3 RCA Hi-Volt Preouts/ Two-Way Crossover/ Built-In MOSFET 50 W x 4 Amplifier/ Supertuner IIID/ Amplifier Off Mode/ Display Off Mode,$308.00,208033806,Pioneer DEHP400UB Car Audio Player,"CD-RW - CD-Text, MP3, WMA, WAV, AAC - 4 - 200W - FM, AM",Pioneer,$134.32,1
33057,208033806,33057,Pioneer Premier In-Dash CD/WMA/MP3/AAC Receiver - DEHP400UB,Pioneer Premier In-Dash CD/WMA/MP3/AAC Receiver - DEHP400UB/ 50W x 4 Built-In Speaker Power/ 3 RCA Hi-Volt Preouts/ Two-Way Crossover/ Supertuner IIID/ AUX-In Connection/ Rotary Commander Volume Control,$183.00,208033806,Pioneer DEHP400UB Car Audio Player,"CD-RW - CD-Text, MP3, WMA, WAV, AAC - 4 - 200W - FM, AM",Pioneer,$134.32,1
32688,208033808,32688,Pioneer Single Din CD Receiver - DEHP3000IB,Pioneer Single Din CD Receiver - DEHP3000IB/ 7-Way Rotary Commander/ Built-In AUX Input/ Detachable Face Security/ Sirius Game Alert And Game Zone/ Passenger Control Mode/ Link Search/ Random Key,,208033808,Pioneer DEH-P3000IB Car Audio Player,"CD-RW - CD-Text, MP3, WMA, WAV, AAC - 4 - 200W - FM, AM",Pioneer,$92.72,1
33455,208033955,33455,Yamaha 5.1 Channel Home Theater In A Box System In Black  - YHT390BK,"Yamaha 5.1 Channel Home Theater In A Box System In Black - YHT390BK/ New Scene, Compressed Music Enhancer/ iPod Compatibility/ 600W Powerful Surround Sound/ Silent Cinema/ 192kHz/24-Bit DACs For All Channels/ Black Finish",$399.00,208033955,Yamaha YHT-390BL Home Theater System - YHT-390bl,", 5.1 Speakers - Progressive Scan - 600W RMS - Black",Yamaha,$319.96,1
34944,208042977,34944,Samsung 67' Black Widescreen Series 7 LED DLP HDTV - HL67A750,"Samsung 67' Black Widescreen Series 7 LED DLP HDTV - HL67A750/ 1920 x 1080p Resolution/ 10,000:1 Contrast Ratio/ Digital Noise Reduction/ CinemaPure Color Engine/ Get The Full Effect Of 3D/ LED Backlight/ NTSC/ATSC/Clear QAM Built-In Tuners/ 60,000 Hours Lamp Life/ Black Finish",,208042977,"Samsung HL-67A750 - 67' Widescreen 1080p DLP HDTV - 10,000:1 Contrast Ratio - HL67A750",,Samsung,"$1,729.98",1
37499,208043057,37499,Nintendo DS Lite Metallic Rose Portable Gaming System - NDSUSGSZPB,Nintendo DS Lite Metallic Rose Portable Gaming System - NDSUSGSZPB/ Dual 3' TFT Color LCD Touchscreens/ Slimmer Design/ Dual Slot Compatibility (DS Lite/Game Boy Advance Game Paks)/ Twin Ultra Bright LCD Screens/ Up To 19 Hours Continuous Gameplay/ Nintendo Wi-Fi Connection/ Impressive 3D Graphics/ Dual Stereo Speakers/ Metallic Rose Finish,$139.00,208043057,Nintendo DS Lite (Metallic Rose) - USGSZPB,,Nintendo Of America,,1
34998,208079230,34998,Samsung 50' Widescreen Plasma HDTV - PN50A650,"Samsung 50' Widescreen Plasma HDTV - PN50A650/ Touch Of Color/ Ultra FilterBright Anti Glare Technology/ 1,000,000:1 Dynamic Contrast Ratio/ Picture-In-Picture/ Anti-Burn-In Technology/ Sports/Game/Movie Modes/ Single Integrated User Interface With Wheel-Key Remote/ ATSC/NTSC/Clear QA Tuners",,208079230,"Samsung PN50A650 50' 1080p Plasma HDTV - 1,000,000:1 Dynamic Contrast Ratio - Anti Burn-in Technology",,Samsung,"$1,699.98",1
35276,208084021,35276,Pioneer KURO 50' Black Plasma HDTV - PDP5020FD,Pioneer KURO 50' Black Plasma HDTV - PDP5020FD/ 1920 x 1080p Full HD Resolution/ New Home Media Gallery Home Network Connectivity/ Four Independent HDMI v1.3 Inputs/ Anti-Reflective Filter/ Cell Structure With Crystal Emissive Layer/ ASIC Video Processing And Scaling/ Detachable Bottom Speaker/ Room Light Sensor/ ATSC/NTSC Tuner With Clear QAM/ 1080p 24/60Hz Signal Via HDMI/ Black Finish,,208084021,Pioneer PDP-5020FD 50' Plasma TV,Pioneer KURO PDP-5020FD - 50' 1080p Plasma HDTV,PIONEER ELECTRONICS USA,"$2,199.98",1
35853,208085175,35853,Pioneer USB iPod Interface Cable - CDIU230V,Pioneer USB iPod Interface Cable - CDIU230V/ Compatible With AVIC-F700BT And AVIC-F900BT Navigation Receivers,$48.00,208085175,Pioneer Direct Control Cable - CD-IU230V,"1 x Proprietary - 1 x Type A USB, 3 x RCA",Pioneer,$41.44,1
32889,208085178,32889,Pioneer Sirius Bus Interface - CDSB10,Pioneer Sirius Bus Interface - CDSB10/ Sirius Connect' Compatibility/ Replay Function/ Game Alert/ Game Zone,$68.00,208085178,Pioneer Cd-sb10 Sirius Interface Cable - CD-SB10,,Pioneer,,1
33081,208085180,33081,Pioneer DEH-2000MP CD/MP3/WMA In-Dash Receiver - DEH2000MP,Pioneer DEH-2000MP CD/MP3/WMA In-Dash Receiver - DEH2000MP/ 50W x 4 Built-In Speaker Power/ LED Display/ Built-In Front Auxiliary Input/  Detachable Face Security/ Remote Control/ Rotary Volume Control,$98.00,208085180,Pioneer DEH-2000MP Car Audio Player,"CD-RW - CD-Text, MP3, WMA, WAV - LCD - 4 - 200W - FM, AM",Pioneer,$84.00,1
32893,208085182,32893,Pioneer HD Radio Tuner - GEXP10HD,"Pioneer HD Radio Tuner - GEXP10HD/ Compatible With  FH-P800BT, FH-P8000BT, DEH-P700BT, DEH-P7000BT, DEH-P600UB, DEH-P6000UB/ 'External Control' Capable",$100.00,208085182,Pioneer GEX-P10HD HD Radio Add-on Tuner for Select In-dash Pioneer Receivers,,Pioneer,,1
35277,208085253,35277,Pioneer KURO 60' Black Plasma HDTV - PDP6020FD,Pioneer KURO 60' Black Plasma HDTV - PDP6020FD/ 1920 x 1080p Full HD Resolution/ New Home Media Gallery Home Network Connectivity/ Four Independent HDMI v1.3 Inputs/ Anti-Reflective Filter/ Cell Structure With Crystal Emissive Layer/ ASIC Video Processing And Scaling/ Detachable Bottom Speaker/ Room Light Sensor/ ATSC/NTSC Tuner With Clear QAM/ 1080p 24/60Hz Signal Via HDMI/ Black Finish,,208085253,Pioneer PDP-6020FD 60' Plasma TV,Pioneer KURO PDP-6020FD - 60' 1080p Plasma HDTV,PIONEER ELECTRONICS USA,,1
34002,208105467,34002,Sony Black 1080p Upscaling 5-Disc DVD Changer - DVPNC800HB,Sony Black 1080p Upscaling 5-Disc DVD Changer - DVPNC800HB/ 5 Disc DVD/CD Changer/ 1080p Upscaling Video Output Through HDMI Connection/ BRAVIA Sync/ High Resolution JPEG Output/ Precision Cinema Progressive Technology/ Precision Drive 3 System/ Child Lock/ Multi Disc Resume/ Multi Brand TV Remote Control/ Black Finish,,208105467,Sony DVP-NC800H/B DVD Player,"DVD+RW, DVD-RW, DVD+R, DVD-R, CD-RW - DVD Video, CD-DA, MP3, JPEG, SVCD, Video CD Playback - 5 Disc(s) - Progressive Scan - Black",Sony,,1
33263,208105573,33263,Alpine V-Power Series 4/3/2 Channel Power Amplifier - MRPF300,"Alpine V-Power Series 4/3/2 Channel Power Amplifier - MRPF300/ 50W x 4 RMS Power Output/ Continuously Adjustable Gain Control/ Dual Sided Glass Epoxy PC Board/ Non-Fading Pre-Amp Output/ Gold Plated Input, Output, Power And Speaker Terminals/ Adjustable Low-Pass/High-Pass Crossover/ MOSFET Power/ Thermal Management Control",,208105573,ALPINE MRP-F300 Car Amplifier,4 Channel(s) - Class AB - 100dB SNR,Alpine,,1
33150,208105630,33150,Pioneer Premier In-Dash CD/WMA/MP3/AAC Receiver - DEHP500UB,Pioneer Premier In-Dash CD/WMA/MP3/AAC Receiver - DEHP500UB/ 50W x 4 Built-In Speaker Power/ 3 RCA Hi-Volt Preouts/ Two-Way Crossover/ Supertuner IIID/ AUX-In Connection/ Rotary Commander Volume Control,$208.00,208105630,Pioneer DEHP500UB Car Audio Player,"CD-RW - CD-Text, MP3, WMA, WAV, AAC - 4 - 200W - FM, AM",Pioneer,$153.64,1
30602,208111280,30602,Panasonic Integrated Black Telephone System With All-Digital Answering System - KXTS620B,Panasonic Integrated Black Telephone System With All-Digital Answering System - KXTS620B/ 2-Way Recording/ Call Waiting Caller ID/ Speakerphone/ 3-Line LCD/ Data Port/ Ringer Indicator Lamp/ Programmable Tone/Pulse/ Wall Mountable/ Black Finish,,208111280,CORDED TELEPHONE - KEYPAD - SINGLE-LINE OPERATION - 2-WAY - LCD DISPLAY - BLACK - KX-TS620B,,Panasonic,,1
33908,208111903,33908,Panasonic Black Blu-ray Disc Theater Sound System - SCBT100,Panasonic Black Blu-ray Disc Theater Sound System - SCBT100/ Full Audio Codec For Blu-ray Disc/ Full-HD 1080p/ Virtual 7.1 Channel Surround With 5 Speakers/ Integrated Universal Dock For iPod/ On-Screen Display For iPod Music Menu/ iPod Video Playback/ SD Memory Card Slot/ Powerful Bass Sound 'Kelton Subwoofer'/ 'Bamboo Diaphragm' Center And Front Speakers/ Wireless Rear Speaker System/ Whisper-Mode Surround/ Black Finish,,208111903,Panasonic SC-BT100 Home Theater System - SC-BT100P-K,"BD Player, 5.1 Speakers - 1 Disc(s) - Progressive Scan - 1250W RMS - Dolby Digital, Dolby TrueHD, Dolby Digital Plus, DTS-HD, DTS",Panasonic,,1
33924,208111904,33924,Panasonic Black DVD Home Theater Sound System - SCPT960,Panasonic Black DVD Home Theater Sound System - SCPT960/ Kelton Subwoofer/ Bamboo Diaphragm Center Speakers/ 1080p Up-Conversion/ Integrated Universal Dock And On-Screen Display For iPod/ iPod Video Playback/ Wireless Rear Speaker System/ Whisper-Mode Surround/ Built-In Dolby Digital And DTS Decoder/ High Speed 5-DVD/CD Changer/ Black Finish,,208111904,Panasonic SC-PT960 Home Theater System,"Panasonic SC-PT960 5-Disc DVD Home Theater System with Kelton Subwoofer, 1080p Up-Conversion, Integrated Universal Dock for iPod, 2 Tower Speakers, Wireless Rear Speaker and VIERA Link",Panasonic,$349.99,1
33998,208112354,33998,Sony BRAVIA Home Theater System - DAVHDX275,Sony BRAVIA Home Theater System - DAVHDX275/ 5.1 Channel Surround/ 1080p Upscaling Via HDMI/ 1000Watts 5-Disc DVD-CD Player/ Multi-Room S-AIR Technology/ BRAVIA Sync/ iPod Cradle/ Digital Media Port/ Digital Cinema Auto Calibration/ Multi Speaker Formation/ Black And Silver Finish,,208112354,Sony BRAVIA DAV-HDX275 Home Theater System,", 5.1 Speakers - 5 Disc(s) - Progressive Scan - 1000W RMS - Dolby Pro Logic II",Sony,,1
34379,208112355,34379,Sony Black Bravia Home Theater System - DAVHDX279W,Sony Black Bravia Home Theater System - DAVHDX279W/ iPod Cradle/ Digital MEDIA Port And S-AIR Surround Wireless Included/ BRAVIA Sync/ 1080p Upscaling Via HDMI/ 5-Disc DVD/CD Player/ Digital Cinema Auto Calibration/ Black Finish,,208112355,Sony BRAVIA DAV-HDX279WC Home Theater System,"DVD Player, 6.1 Speakers - 5 Disc(s) - Progressive Scan - Dolby Digital, DTS, Dolby Pro Logic II - Black",Sony,$318.01,1
33763,208112356,33763,Sony DVP-FX820 Blue 8' Portable DVD Player - DVPFX820LI,"Sony DVP-FX820 Blue 8' Portable DVD Player - DVPFX820LI/ Swivel & Flip Screen With Dual Sensor For Remote Control/ Control Buttons On Screen Bezel/ 12 Bit Video DAC With 108 MHz Processing/ Removable, Rechargeable Battery & Car Adapter Included/ Blue Finish",,208112356,Sony DVP-FX820/L Portable DVD Player - DVPFX820/L,"8' LCD - DVD+R, DVD+RW, DVD-RW, DVD-R, CD-RW - JPEG, MP3, DVD Video Playback - 1 Disc(s) - Blue",Sony,$131.54,1
33767,208112357,33767,Sony DVP-FX820 Red 8' Portable DVD Player - DVPFX820R,"Sony DVP-FX820 Red 8' Portable DVD Player - DVPFX820R/ Swivel & Flip Screen With Dual Sensor For Remote Control/ Control Buttons On Screen Bezel/ 12 Bit Video DAC With 108 MHz Processing/ Removable, Rechargeable Battery & Car Adapter Included/ Red Finish",,208112357,Sony DVP-FX820/R Portable DVD Player - DVPFX820/R,"8' LCD - DVD+RW, DVD-RW, DVD+R, DVD-R, CD-RW - DVD Video, CD-DA, MP3, JPEG Playback - 1 Disc(s) - Red",Sony,$159.94,1
33999,208112358,33999,Sony Silver 1080p Upscaling DVD Player - DVPNS700HS,Sony Silver 1080p Upscaling DVD Player - DVPNS700HS/ 1080p Upscaling Video Output Through HDMI Connection/ BRAVIA Sync/ High Resolution JPEG Output/ Precision Cinema Progressive Technology/ Precision Drive/ Child Lock/ Multi Disc Resume/ Multi Brand TV Remote Control/ Silver Finish,,208112358,Sony DVP-NS700H/S DVD Player - DVPNS700HS,"DVD+RW, DVD-RW, DVD+R, DVD-R, CD-RW - DVD Video, CD-DA, MP3, JPEG, SVCD, Video CD Playback - 1 Disc(s) - Progressive Scan - Silver",Sony,$111.68,1
34860,208114664,34860,LG LDC22720ST 22 Cu. Ft. Smooth White Bottom Freezer Refrigerator - LDC22720SS,LG LDC22720ST 22 Cu. Ft. Stainless Steel Bottom Freezer Refrigerator - LDC22720SS/ 4 Split Tempered Glass Shelves/ Upfront Digital Temperature Controls/ 2 Clear Humidity Controlled Crispers/ Multi-Air Flow Cooling/ IcePlus Accelerated Freezing Function/ LoDecibel Quiet Operation/ BioShield Anti-Bacterial Door Seal/ Freezer Drawer/ Stainless Steel Finish,,208114664,LG 22 Cu.Ft. Total Capacity,,LG Electronics,,1
34937,208114670,34937,LG LFC23760ST 22.6 Cu. Ft. Stainless Steel French Door Bottom Freezer Refrigerator - LFC23760SS,LG LFC23760ST 22.6 Cu. Ft. Stainless Steel French Door Bottom Freezer Refrigerator - LFC23760SS/ 4 Split Tempered Glass Shelves/ Upfront Digital Temperature Controls/ 2 OptiBin Clear Humidity Crispers/ Multi-Air Flow Cooling/ IcePlus Accelerated Freezing Function/ LoDecibel Quiet Operation/ BioShield Anti-Bacterial Door Seal/ Pull-Out Freezer Drawer/ Stainless Steel Finish,,208114670,LG 22.6 Cu.Ft. Total Capacity,,LG Electronics,,1
34946,208114672,34946,LG LFC25770SB 25.0 Cu. Ft. Smooth Black French Door Bottom Freezer Refrigerator - LFC25770BK,LG LFC25770SB 25.0 Cu. Ft. Smooth Black French Door Bottom Freezer Refrigerator - LFC25770BK/ 4 Slide Out Tempered Glass Shelves/ Internal LED Touch Pad Digital Temperature Controls/ 2 Humidity Crispers/ Multi Air Flow Cooling/ IcePlus Accelerated Freezing Function/ LoDecibel Quiet Operation/ BioShield Anti Bacterial Door Seal/ Pull Out Freezer Drawer/ Smooth Black Finish,,208114672,LG 25.0 Cu.Ft. Total Capacity,,LG Electronics,,1
34947,208114673,34947,LG LFC25770ST 25.0 Cu. Ft. Stainless Steel French Door Bottom Freezer Refrigerator - LFC25770SS,LG LFC25770ST 25.0 Cu. Ft. Stainless Steel French Door Bottom Freezer Refrigerator - LFC25770SS/ 4 Slide Out Tempered Glass Shelves/ Internal LED Touch Pad Digital Temperature Controls/ 2 Humidity Crispers/ Multi-Air Flow Cooling/ IcePlus Accelerated Freezing Function/ LoDecibel Quiet Operation/ BioShield Anti-Bacterial Door Seal/ Pull-Out Freezer Drawer/ Stainless Steel Finish,,208114673,LG 25.0 Cu.Ft. Total Capacity,,LG Electronics,,1
34945,208114674,34945,LG LFC25770SW 25.0 Cu. Ft. Smooth White French Door Bottom Freezer Refrigerator - LFC25770WH,LG LFC25770SW 25.0 Cu. Ft. Smooth White French Door Bottom Freezer Refrigerator - LFC25770WH/ 4 Slide Out Tempered Glass Shelves/ Internal LED Touch Pad Digital Temperature Controls/ 2 Humidity Crispers/ 4 Compartment Crisper System/ Multi Air Flow Cooling/ IcePlus Accelerated Freezing Function/ LoDecibel Quiet Operation/ BioShield Anti Bacterial Door Seal/ Pull Out Freezer Drawer/ Smooth White Finish,,208114674,LG 25.0 Cu.Ft. Total Capacity,,LG Electronics,,1
34948,208114675,34948,LG 25.0 Cu. Ft. Titanium French Door Bottom Freezer Refrigerator - LFC25770TT,LG 25.0 Cu. Ft. Titanium French Door Bottom Freezer Refrigerator - LFC25770TT/ 4 Slide Out Tempered Glass Shelves/ Internal LED Touch Pad Digital Temperature Controls/ 2 Humidity Crispers/ Multi-Air Flow Cooling/ IcePlus Accelerated Freezing Function/ LoDecibel Quiet Operation/ BioShield Anti-Bacterial Door Seal/ Pull-Out Freezer Drawer/ Titanium Finish,,208114675,LG 25.0 Cu.Ft. Total Capacity,,LG Electronics,,1
34962,208114681,34962,LG LFX25971SB 24.7 Cu. Ft. Smooth Black French Door Bottom Freezer Refrigerator - LFX25971BK,LG LFX25971SB 24.7 Cu. Ft. Smooth Black French Door Bottom Freezer Refrigerator - LFX25971BK/ 3 Slide Out Tempered Glass Shelves/ Digital LED Display/ SmoothTouch Digital Temperature Controls/ 2 Humidity Crispers/ Multi-Air Flow Cooling/ IcePlus Accelerated Freezing Function/ LoDecibel Quiet Operation/ BioShield Anti-Bacterial Door Seal/ Pull-Out Freezer Drawer/ Smooth Black Finish,,208114681,LG 25 Cu. Ft. Ice & Water Dispensing,,LG Electronics,,1
34963,208114682,34963,LG LFX25971ST 24.7 Cu. Ft. Stainless Steel French Door Bottom Freezer Refrigerator - LFX25971SS,LG LFX25971ST 24.7 Cu. Ft. Stainless Steel French Door Bottom Freezer Refrigerator - LFX25971SS/ 3 Slide Out Tempered Glass Shelves/ Digital LED Display/ SmoothTouch Digital Temperature Controls/ 2 Humidity Crispers/ Multi-Air Flow Cooling/ IcePlus Accelerated Freezing Function/ LoDecibel Quiet Operation/ BioShield Anti-Bacterial Door Seal/ Pull-Out Freezer Drawer/ Stainless Steel Finish,,208114682,LG 24.7 cu. ft. Stainless Steel French Door Bottom Mount Refrigerator,,LG Electronics,,1
34961,208114683,34961,LG LFX25971SW 24.7 Cu. Ft. Smooth White French Door Bottom Freezer Refrigerator - LFX25971WH,LG LFX25971SW 24.7 Cu. Ft. Smooth White French Door Bottom Freezer Refrigerator - LFX25971WH/ 3 Slide Out Tempered Glass Shelves/ Digital LED Display/ SmoothTouch Digital Temperature Controls/ 2 Humidity Crispers/ Multi-Air Flow Cooling/ IcePlus Accelerated Freezing Function/ LoDecibel Quiet Operation/ BioShield Anti-Bacterial Door Seal/ Pull-Out Freezer Drawer/ Smooth White Finish,,208114683,LG 25 CF Refrigerator 3 Door White Tall,,LG Electronics,,1
35231,208114686,35231,LG LMX25981ST 24.7 Cu. Ft. Capacity Stainless Steel French Door Refrigerator - LMX25981SS,"LG LMX25981ST 24.7 Cu. Ft. Capacity Stainless Steel French Door Refrigerator - LMX25981SS/ Double Freezer Drawers/ Tall Ice & Water Dispensing Center/ Sophisticated Design, Inside & Out/ 4 Compartment Crisper System/ LoDecibel Quiet Operation/ Contour Doors With Hidden Hinges/ Premium LED Interior Light/ Stainless Steel Finish",,208114686,LG 25 Cu.Ft. Total Capacity 4 Door Refrigerator,,LG Electronics,,1
35190,208117918,35190,LG 24' LDF6920BB Fully Integrated Built In Black Dishwasher - LDF6920BK,LG 24' LDF6920BB Fully Integrated Built In Black Dishwasher - LDF6920BK/ XL Tall Tub Cleans Up To 16 Place Settings At Once/ Adjustable Upper Rack/ LoDecibel Quiet Operation/ SenseClean Wash System/ 5 Wash Cycles With 3 Spray Arms/ Multi-Level Water Direction/ Slim Direct Drive Motor/ Fully Integrated Electronic Control Panel/ Black Finish,,208117918,LG LDF6920BB Fully Integrated Dishwasher,,LG Electronics,,1
35186,208117919,35186,LG 24' LDF6920ST Fully Integrated Built In Stainless Steel Dishwasher - LDF6920SS,LG 24' LDF6920ST Fully Integrated Built In Stainless Steel Dishwasher - LDF6920SS/ XL Tall Tub Cleans Up To 16 Place Settings At Once/ Adjustable Upper Rack/ LoDecibel Quiet Operation/ SenseClean Wash System/ 5 Wash Cycles With 3 Spray Arms/ Multi-Level Water Direction/ Slim Direct Drive Motor/ Fully Integrated Electronic Control Panel/ Stainless Steel Finish,,208117919,"LG LDF6920ST Fully Integrated Dishwasher with 5 Wash Cycles, 3 Spray Arms, SenseClean System, Delay Start, Food Disposer and Self-Clean Filter: Stainless Steel",,LG Electronics,,1
35183,208117920,35183,LG 24' LDF6920WW Fully Integrated Built In White Dishwasher - LDF6920WH,LG 24' LDF6920WW Fully Integrated Built In White Dishwasher - LDF6920WH/ XL Tall Tub Cleans Up To 16 Place Settings At Once/ Adjustable Upper Rack/ LoDecibel Quiet Operation/ SenseClean Wash System/ 5 Wash Cycles With 3 Spray Arms/ Multi-Level Water Direction/ Slim Direct Drive Motor/ Fully Integrated Electronic Control Panel/ White Finish,,208117920,LG Dishwasher,,LG Electronics,,1
35175,208117922,35175,LG 24' LDS4821BB Semi Integrated Built In Black Dishwasher - LDS4821BK,LG 24' LDS4821BB Semi Integrated Built In Black Dishwasher - LDS4821BK/ XL Tall Tub Cleans Up To 16 Place Settings At Once/ Adjustable Upper Rack/ LoDecibel Quiet Operation/ SenseClean Wash System/ 4 Wash Cycles With 3 Spray Arms/ Multi-Level Water Direction/ Slim Direct Drive Motor/ Semi-Integrated Electronic Control Panel/ Black Finish,,208117922,LG Semi-Integrated Electronic Panel with Digital Status Display,,LG Electronics,,1
35165,208117924,35165,LG 24' LDS4821WW Semi Integrated Built In White Dishwasher - LDS4821WH,LG 24' LDS4821WW Semi Integrated Built In White Dishwasher - LDS4821WH/ XL Tall Tub Cleans Up To 16 Place Settings At Once/ Adjustable Upper Rack/ LoDecibel Quiet Operation/ SenseClean Wash System/ 4 Wash Cycles With 3 Spray Arms/ Multi-Level Water Direction/ Slim Direct Drive Motor/ Semi-Integrated Electronic Control Panel/ White Finish,,208117924,LG Semi-Integrated Electronic Panel with Digital Status Display Dishwasher,,LG Electronics,,1
