idAbt,idBuy,id_abt,name_abt,description_abt,price_abt,id_buy,name_buy,description_buy,manufacturer,price_buy,is_match
38477,10011646,38477,Linksys EtherFast 8-Port 10/100 Switch - EZXS88W,Linksys EtherFast 8-Port 10/100 Switch - EZXS88W/ 10/100 Dual-Speed Per-Port/ Perfect For Optimizing 10BaseT And 100BaseTX Hardware On The Same Network/ Speeds Of Up To 200Mbps In Full Duplex Operation/ Eliminate Bandwidth Constraints And Clear Up Bottlenecks,$44.00,10011646,Linksys EtherFast EZXS88W Ethernet Switch - EZXS88W,Linksys EtherFast 8-Port 10/100 Switch (New/Workgroup),LINKSYS,,1
38475,10140760,38475,Linksys EtherFast10/100 5-Port Auto-Sensing Switch - EZXS55W,"Linksys EtherFast10/100 5-Port Auto-Sensing Switch - EZXS55W/ 5 Port 10/100 Autosensing Ports With Both Half And Full Duplex Modes/ Perfect For Integrating Your 10BaseT And 100BaseTX Network Hardware/ Switched 10/100 Ports Run At 10Mbps, 20Mbps, 100Mbps Up To 200Mbps",$29.00,10140760,Linksys EtherFast EZXS55W Ethernet Switch,5 x 10/100Base-TX LAN,LINKSYS,,1
33053,10221960,33053,Netgear ProSafe 5 Port 10/100 Desktop Switch - FS105,Netgear ProSafe 5 Port 10/100 Desktop Switch - FS105/ 5 Auto Speed-Sensing 10/100 UTP Ports/ Embedded Memory,$40.00,10221960,Netgear ProSafe FS105 Ethernet Switch - FS105NA,NETGEAR FS105 Prosafe 5 Port 10/100 Desktop Switch,Netgear,,1
27248,10246269,27248,Belkin F3H982-10 Pro Series High Integrity 10 Feet Monitor Cable - F3H98210,Belkin F3H982-10 Pro Series High Integrity 10 Feet Monitor Cable - F3H98210/ Recommended For Monitors 17' And Larger/ Designed To Support High Resolution Imaging And High Speed/ Double Shielding/ Gold Plated Copper Contacts,,10246269,Belkin Pro Series High Integrity VGA/SVGA Monitor Extension Cable - F3H982-10,1 x HD-15 - 1 x HD-15 - 10ft - Beige,Belkin,,1
25262,10315184,25262,Netgear Prosafe 16 Port 10/100 Rackmount Switch - Black Finish - JFS516NA,"Netgear Prosafe 16 Port 10/100 Rackmount Switch - JFS516NA/ Sixteen Switched Ports Provide Private Bandwidth For PCs, Servers Or Hubs/ Store-And-Forward Packet Switching/ Compatible With All Major Network Software/ Auto Detects Speed And Duplex/ Black Finish",$131.00,10315184,Netgear ProSafe JFS516 Ethernet Switch,Netgear ProSafe 16 Port 10/100 Rackmount Switch- JFS516NA,Netgear,,1
36260,10316920,36260,LaCie USB 2.0 Floppy Disk Drive - 706018,LaCie USB 2.0 Floppy Disk Drive - 706018/ Ultra-Thin Portable Design/ Compatible With Windows And Mac OS/ Plug And Play/ USB Powered/ 250 - 500 kbps Transfer Rate/ Silver Finish,$49.00,10316920,LaCie Pocket Floppy Disk Drive - 706018,LaCie Pocket USB Floppy 1.44 MB,LACIE,,1
35810,10326220,35810,Canon KP-36IP Color Ink & Paper Set - 7737A001,Canon KP-36IP Color Ink & Paper Set - 7737A001/ 36 Sheets Of 4' x 6' Photo Paper/ Ink Cartridge For Compatible Canon Dye Sublimation Printer,$12.00,10326220,Canon KP 36IP Print Cartridge / Paper Kit - 7737A001,36 Page 4' x 6',Canon,$9.99,1
32034,10333368,32034,Kensington Orbit Optical Trackball Mouse - 64327,Kensington Orbit Optical Trackball Mouse - 64327/ DiamondEye Optical Technology For Precise Tracking And Cursor Control/ USB And PS/2 Connectivity For Greater Compatibility/ Windows And Mac Compatible/ Metallic Silver And Black Finish,$38.00,10333368,Kensington Orbit Optical Trackball - USB w/PS2 Adapter - 64327,"Optical - USB, PS/2",Kensington,,1
38473,10333846,38473,Linksys EtherFast4116 16-Port 10/100 Ethernet Switch - EF4116,Linksys EtherFast4116 16-Port 10/100 Ethernet Switch - EF4116/ 16 Autosensing 10/100 Full Duplex Auto MDI/MDI-X Ports/ Run Blazing Speeds Up To 200Mbps/ Address Learning And Aging And Data Flow Control,$79.00,10333846,Linksys EtherFast EF4116 Ethernet Switch,16 x 10/100Base-TX LAN,LINKSYS,,1
23686,10333848,23686,Linksys EtherFast 4124 24-Port Ethernet Switch - EF4124,"Linksys EtherFast 4124 24-Port Ethernet Switch - EF4124/ 24 Autosensing 10/100 Full Duplex, Auto MDI/MDI-X Ports/ Up To 200Mbps/ Address Learning, Aging And Data Flow Control/ Compact Size",$119.00,10333848,Linksys EtherFast EF4124 Ethernet Switch,24 x 10/100Base-TX LAN,LINKSYS,$64.99,1
38474,10343605,38474,Linksys Gigabit 5-Port Workgroup Switch - EG005W,"Linksys Gigabit 5-Port Workgroup Switch - EG005W/ Five 10/100/1000Mbps, Half/Full Duplex, Switched Ports/ Forwards And Filters Packets At Non-Blocking, Full Wire Speed/ All Ports Have Auto Speed Negotiation And Auto MDI/MDI-X Crossover Detection/ Supports Address Learning And Aging, 802.3x Flow Control And Head-Of-Line Blocking Prevention",$64.00,10343605,Linksys Instant Gigabit EG005W Ethernet Switch,Linksys EG005W Gigabit 5-Port Workgroup Switch,LINKSYS,,1
33377,10346525,33377,Linksys Wireless-G Ethernet Bridge - WET54G,"Linksys Wireless-G Ethernet Bridge - WET54G/ Converts Wired-Ethernet Devices To Wireless-G Network Connectivity/ For Windows, Macintosh, Linux, PlayStation Consoles, Xbox Consoles, Or Anything With An Ethernet Port/ Plug And Play, No Driver Installation Require",$89.00,10346525,Linksys G Wireless-G WET54G Wireless Bridge,54Mbps - 1 x 10/100Base-TX,LINKSYS,,1
27479,10351869,27479,Tripp-Lite PV375 PowerVerter 375-Watt Ultra-Compact Inverter - PV375,Tripp-Lite PV375 PowerVerter 375-Watt Ultra-Compact Inverter - PV375/ 12V DC Input/ 120V AC Output/ 2 Outlets/ 375 Watts Continuous Output/ 600 Watts Peak Output/ Convenient Cigarette Lighter Plug,$49.00,10351869,Tripp Lite PowerVerter 375-Watt Ultra-Compact Inverter - PV375,Input Voltage:12V DC - Output Voltage:120V AC - 375W Pulse-width Modulated Sine Wave,Tripp Lite,,1
37606,10353206,37606,Netgear Prosafe 5 Port Gigabit Ethernet Desktop Switch - GS105NA,Netgear Prosafe 5 Port Gigabit Ethernet Desktop Switch - GS105NA/ Auto-Switching Ethernet Connection/ Supports Windows And Macintosh Platforms/ Dual Color LEDs/ AutoUplink Technology/ Compact Metal Case/ Fanless Design/ Plug-And-Play Installation,$55.00,10353206,Netgear ProSafe GS105 Ethernet Switch - GS105NA,NETGEAR ProSafe 5 Port Gigabit Desktop Switch,Netgear,,1
27975,10360978,27975,Belkin F3H982-25 Black 25 Ft Pro Series High Integrity VGA/SVGA Monitor Replacement Cable - F3H98225,Belkin F3H982-25 Black 25 Ft Pro Series High Integrity VGA/SVGA Monitor Replacement Cable - F3H98225/ Constructed Of 3 Coaxial And 5 Twisted Pair Cable/ Compatible With The PC/ Aluminum Undermold Shield/ Double Shielding/ Gold Plated Copper Contacts,,10360978,Belkin Monitor Cable - F3H982-25,1 x HD-15 - 1 x HD-15 - 25ft - Black,Belkin,$15.98,1
36207,10363070,36207,Logitech Driving Force Pro Steering Wheel With Pedals Set For Sony Playstation 2 - 9632930403,Logitech Driving Force Pro Steering Wheel With Pedals Set For Sony Playstation 2 - 9632930403/ Comfortable Soft Full Rubber Wheel/ Realistically Turn Through 2.5 Times Wheel Rotation/ 900 Degrees Of wheel Steering/ State-Of-The-Art Force Feedback Technology/ Stick Shifter/ Responsive Gas And Brake Pedals/ Black Finish,$129.00,10363070,Logitech Driving Force Pro for PlayStation 2 - 963293-0403,,Logitech,,1
17372,10363243,17372,Belkin AC Anywhere - F5C400300W,Belkin AC Anywhere - F5C400300W/ Mobile Power Adapter For Your Vehicle/ Powers Portable Devices Using A 300-Watt Power Inverter/ 2 AC Outlets/ Converts DC Power To AC Power From A Cigarette Lighter Socket/ Automatic Overheat Shut-Off/ Low-Battery Alarm/ Overload Protection/ Replaceable Fuse Included/ Power LED Indicator,,10363243,Belkin AC Anywhere 300W Power Inverter - F5C400-300W,Input Voltage:12V DC - Output Voltage:110V AC - 300W Stepped Sine Wave,Belkin,,1
39179,10365096,39179,Linksys Wireless-G Range Expander - WRE54G,Linksys Wireless-G Range Expander - WRE54G/ Supports 64/128-Bit WEP Encryption In 802.11b/802.11g Wireless LAN/ Configurable Through Your Networked PC?s Web Browser Or The Included Setup Wizard/ Expand Your Wireless Coverage To Eliminate Dead Spots/ Works With Both 802.11b And 802.11g Wireless Networks/ RJ-45 10/100 Port For Easy Configuration/ Silver Finish,$99.00,10365096,Linksys Wireless-G Range Expander Wireless Bridge - WRE54G,54Mbps,LINKSYS,,1
21047,10373002,21047,Sony VAIO Neoprene Notebook With AC Adapter Case - Black Finish - VGPAMC2,"Sony VAIO Neoprene Notebook With AC Adapter Case - VGPAMC2/ Helps Protect Your Notebook From Scratches, Spills And Dings/ Neoprene Offers Durable, Water-Resistant Protection/ Fits 17' Widescreen Notebooks",$24.00,10373002,Sony VAIO Notebook and AC Adapter Case - VGPAMC2,VAIO NEOPRENE NOTEBOOK & AC ADAPTER CASE UP TO 17 IN LCD,Sony,,1
36258,10376165,36258,D-Link Broadband Cable Modem - DCM202,D-Link Broadband Cable Modem - DCM202/ DOCSIS 2.0 CableLabs Certified/ High-Speed Internet Connectivity/ Always On And Always Connected/ Ethernet Or USB Connectivity/ Front Panel LED Indicator Lights/ Grey Finish,$79.00,10376165,D-Link Express EtherNetwork High-Speed DOCSIS 2.0 Cable Modem - DCM-202,D-Link Broadband Cable Modem,D-Link,,1
20448,10377226,20448,Sony VAIO Neoprene Laptop Carrying Case - Black Finish - VGPAMC3,"Sony VAIO Neoprene Laptop Carrying Case - VGPAMC3/ Compatible With VAIO A Series 15' And FS Series 15.4' Widescreen Notebooks/ Helps Protect Your Notebook From Scratches, Spills And Dings/ Neoprene Offers Durable And Water-Resistant Protection",$22.00,10377226,Sony Notebook and AC Adapter Cases - VGPAMC3,Clam Shell - Neoprene,Sony,$12.99,1
13202,10379358,13202,Panasonic Laser Toner Cartridge - KXFA83,Panasonic Laser Toner Cartridge - KXFA83/ Used With FL511/F541 Fax Machines,,10379358,Panasonic Black Toner Cartridge - KX-FA83,"Panasonic Toner Cartridge for the KX-FL511, KX-FL541, KX-FL611 and KX-FLM651 Series",Panasonic,,1
39176,10380060,39176,Logitech 2.1 Multimedia Silver Speaker System - Z2300,Logitech 2.1 Multimedia Silver Speaker System - Z2300/ THX-Certified/ 200 Watts Of RMS Power (400 Watts Of Peak Power)/ Distortion-Free Bass/ Phase Plug Design/ SoundTouch Wired Remote Control/ Multiple Source?Ready/ 2.5' Polished Aluminum Phase Plug Speaker Driver/ 8' Long-Throw Ported Subwoofer Driver/ Silver Finish,,10380060,Logitech Z-2300 Multimedia Speaker System - 970118-0403,2.1-channel,Logitech,,1
32579,10388980,32579,Netgear Wireless Access Point - WG102,"Netgear Wireless Access Point - WG102/ High-Speed IEEE 802.11g, Up To 108 Mbps In Turbo Mode/ Wi-Fi Protected Access (WPA 802.11i-Ready Security)/ Integrated IEEE 802.3af Power Over Ethernet (PoE)/ Block SSID Broadcast/ VPN Pass-Through Support",$186.00,10388980,Netgear ProSafe WG102 Wireless Access Point 802.11g - WG102NA,NETGEAR Prosafe 802.11g Wireless Access Point,Netgear,,1
22558,10412590,22558,Netgear RangeMax Wireless Access Point - White Finish - WPN802NA,"Netgear RangeMax Wireless Access Point - WPN802NA/ Improves Performance Of Existing Legacy 802.11b And 802.11g Wireless Devices Up To 50 Percent/ Wired Equivalent Privacy (WEP) 64-Bit,128-Bit Encryption/ Wi-Fi Protected Access (WPA, Pre-Shared Key)",$130.00,10412590,Netgear RangeMax WPN802 Wireless Access Point - WPN802NA,108Mbps,Netgear,,1
21175,10412788,21175,NetGear ProSafe 24 Port Smart Switch - FS726TP,NetGear ProSafe 24 Port Smart Switch - FS726TP/ Two Gigabit Ports Plus Easy Browser/ ProSafe Network Management Software/ Web Based Smart Management Features,$605.00,10412788,Netgear ProSafe FS726TP 24 Port 10/100 Smart Switch - FS726TPNA,"24 x 10/100Base-TX LAN, 2 x 10/100/1000Base-T",Netgear,,1
26461,200924629,26461,Linksys Wireless-G VPN Broadband Silver Router - WRV54G,"Linksys Wireless-G VPN Broadband Silver Router - WRV54G/ Built-In VPN Endpoint Capability/ Securely Connect Up To 50 Remote Or Traveling Users To Your Office Network Via VPN/ Hotspot Ready With Subscriber Registration, Authorization And Authentication Functions/ Silver Finish",$149.00,200924629,Linksys WRV54G Wireless-G VPN Broadband Router,,,,1
23296,201647442,23296,Kingdom Hearts II Video Game For The Sony PS2 - 662248904115,"Kingdom Hearts II Video Game For The Sony PS2 - 662248904115/ Guide Sora And Friends In All-New locales Based On Disney Films/ Fight Alongside Classic Final Fantasy Characters As Well As Modern Disney Heroes/ Perform New Character-Specific Double Team Attacks While Battling Enemies/ Visit Beasts Castle, Port Royale, Pride Land, Agrabah, Halloween Town, And More/ Rated E For Everyone 10 And Older",,201647442,Kingdom Hearts II,,"SQUARE ENIX, LLC",$19.99,1
20454,201692648,20454,Canon Magenta Ink Tank - Magenta - CLI8M,"Canon Magenta Ink Tank - CLI8M/ Compatible With The Pixma iP4200, iP5200, iP5200R, iP6600D, MP500, MP800 Printers",$16.00,201692648,Canon CLI-8M Ink Cartridge - 0622B002,Magenta,Canon,$10.35,1
20450,201692660,20450,Canon Color Ink Tank - CL41CL,"Canon Color Ink Tank - CL41CL/ Compatible With The Pixma iP1600, MP170 Printers",$24.00,201692660,"Canon Ink Cartridge For PIXMA iP1600, iP6210D and iP6220D Printers - 0617B002",Color,Canon,$19.11,1
33047,201692665,33047,Canon Black Photo Ink Cartridge - CLI8B,Canon Black Photo Ink Cartridge - CLI8B/ FINE Technology For Exceptional Sharpness & Detail/ Compatible With Canon Pixma Printers,$16.00,201692665,"Canon Ink Cartridge For PIXMA iP4200, iP5200, iP5200R and iP6600D Printers - 0620B002",Black,Canon,$13.99,1
20453,201692677,20453,Canon Cyan Ink Tank - Cyan - CLI8C,"Canon Cyan Ink Tank - CLI8C/ Compatible With The Pixma iP4200, iP5200, iP5200R, iP6600D, MP500, MP800 Printers",$16.00,201692677,Canon CLI-8C Ink Cartridge - 0621B002,Cyan,Canon,$13.99,1
20461,201692679,20461,Canon Yellow Ink Cartridge - Yellow - CLI8Y,"Canon Yellow Ink Cartridge - CLI8Y/ Compatible With The Pixma iP4200, iP5200,  iP5200R, iP6600D, MP500, MP800 Printers",$16.00,201692679,Canon CLI-8Y Ink Cartridge - 0623B002,Yellow,Canon,$13.99,1
20466,201692695,20466,Canon Black Ink Cartridge - Black - PG40BK,"Canon Black Ink Cartridge - PG40BK/ Compatible With The Pixma iP1600, MP170 Printers",$19.00,201692695,Canon Black Ink Cartridge - 0615B002,Black,Canon,,1
26617,201692705,26617,Canon PGI-5BK Black Ink Tank Cartridge - PGI5BK,Canon PGI-5BK Black Ink Tank Cartridge - PGI5BK/ Smudge Resistant/ Resists Smearing Caused By Highlighters/ Smudge Resistant/ Pigment Ink Formulation For Long Lasting Prints,$16.00,201692705,Canon PGI-5BK Black Ink Cartridge - 0628B002,Canon PGI-5 Pigment Black Ink Cartridge for Canon ContrastPLUS Photo Printers,Canon,$14.99,1
35467,201699873,35467,Peerless 23' - 46' Universal Flat Panel TV Black Wall Mount - SF640P,Peerless 23' - 46' Universal Flat Panel TV Black Wall Mount - SF640P/ Supports Up To 150 Lbs/ Open Wall Plate Design/ Ultra-Slim Design Holds Screen Only 1.2' From The Wall/ Black Finish,,201699873,Peerless Universal Flat Wall Mount - SF640P,Peerless Flat Wall Mount for 23'- 46' LCD Screens - Black,Peerless,,1
21875,201700823,21875,Netgear ProSafe 16 Port 10/100 Desktop Switch - Purple Finish - FS116P,Netgear ProSafe 16 Port 10/100 Desktop Switch - FS116P/ 16 Auto Speed-Sensing 10/100 RJ-45 Ports/ 96 KB Embedded Memory Per Unit,$299.00,201700823,Netgear ProSafe FS116P Ethernet Switch - FS116PNA,16 x 10/100Base-TX LAN,Netgear,,1
35111,201701865,35111,Peerless 37' - 60' Flat Panel TV Black Wall Mount  - ST660P,Peerless 37' - 60' Flat Panel TV Black Wall Mount  - ST660P/ Plasma Flat Panel TVs/ 200 lbs Load Capacity/ Up To 15 Degrees Of Forward Tilt And -5 Degrees Backward Tilt/ Black Finish,,201701865,Peerless Universal Tilt Wall Mount,Peerless Smart Mount ST660P Universal Tilt Wall Mount for 37' to 60' Screens (Black) up to 200lbs,Peerless,,1
38231,201744288,38231,Netgear ProSafe 24-Port Gigabit Rackmount Switch With 2 SFP Slots - JGS524F,"Netgear ProSafe 24-Port Gigabit Rackmount Switch - JGS524F/ 24 10/100/1000 Mbps Ports/ Automatic Speed/ Full/Half-Duplex Sensing/ Auto Uplink/ Two Hot-Swappable Small Form Factor Pluggable GBIC Slots/ Up To 48 Gbps Of Switching Capacity/ Compatible With PC, Macintosh, Linux, And Unix Operating Systems",,201744288,Netgear ProSafe JGS524F 24-Port Gigabit Ethernet Switch - JGS524FNA,Netgear ProSafe JGS544F - 24 Port Gigabit Rackmount Switch with 2 Gigabit Slots,Netgear,,1
38831,201854347,38831,Tripp-Lite Black 25 Foot SVGA HD15M To HD15M Computer Monitor Cable - P502025,Tripp-Lite Black 25 Foot SVGA HD15M To HD15M Computer Monitor Cable - P502025/ 25 Foot Length/ Foil-Shielding For Maximum EMI/RFI Protection/ Constructed From Mini-Coax And Paired Video/ Gold Plated Connectors And Gold Plated Copper Contacts/ HD15 Male To HD15 Male Molded Connectors/ Black Finish,,201854347,Tripp Lite Video Cable - P502-025,1 x HD-15 - 1 x HD-15 - 25ft - Black,Tripp Lite,,1
32625,201935116,32625,Logitech diNovo Media Desktop Laser Keyboard And Mouse Combo - 967562,Logitech diNovo Media Desktop Laser Keyboard And Mouse Combo - 967562/ Unique Ultra-Flat Keyboard/ Detached Customizable MediaPad/ Precision Rechargeable Laser Mouse/ Tilt Wheel Plus Zoom/ Customizable Hotkeys/ Dedicated Search Buttons/ Bluetooth Wireless Technology Compatible/ Black And Gray Finish,$199.00,201935116,Logitech diNovo Media Desktop Laser - 967562-0403,Keyboard - Wireless - Mouse - Laser - Type A - USB - Receiver,Logitech,,1
32625,201935171,32625,Logitech diNovo Media Desktop Laser Keyboard And Mouse Combo - 967562,Logitech diNovo Media Desktop Laser Keyboard And Mouse Combo - 967562/ Unique Ultra-Flat Keyboard/ Detached Customizable MediaPad/ Precision Rechargeable Laser Mouse/ Tilt Wheel Plus Zoom/ Customizable Hotkeys/ Dedicated Search Buttons/ Bluetooth Wireless Technology Compatible/ Black And Gray Finish,$199.00,201935171,Logitech Cordless Desktop MX 5000 Laser - 967562-0403,Keyboard - Wireless - 104 Keys - Mouse - Laser - Type A - USB - Receiver,Logitech,,1
22100,201953026,22100,Canon High Capacity Color Ink Cartridge - Color Ink - CL51,"Canon High Capacity Color Ink Cartridge - CL51/ Compatible With Pixma iP6210D, iP6220D, MP150, MP170 And MP450 Printers",$35.00,201953026,"Canon CL-51 High Capacity Color Ink Cartridge For PIXMA MP450, PIXMA iP6210D and PIXMA iP6220D Printers - 0618B002",Color,Canon,,1
29758,201953029,29758,Canon Black Ink Cartridge - PG50,Canon Black Ink Cartridge - PG50/ Pigment Ink Formulation For Long Lasting Prints/ Resists Smearing Caused By Highlighters/ Smudge Resistant/ Ink Remaining Notification Technology/ Crisp Laser Text-Quality Text/ Black Ink,$29.00,201953029,Canon PG-50 High Capacity Black Ink Cartridge For PIXMA MP450 Printer - 0616B002,Black,Canon,,1
22101,201953039,22101,Canon Photo Ink Cartridge - CL52,Canon Photo Ink Cartridge - CL52/ Compatible With Pixma iP6210D And iP6220D Printers,$25.00,201953039,Canon CL-52 Photo Ink Cartridge For PIXMA iP6210D and PIXMA iP6220D Printers - 0619B002,Color,Canon,$18.16,1
16741,201959840,16741,Delonghi Twenty Four Seven Coffee Maker In Black - DC50B,"Delonghi Twenty Four Seven Coffee Maker - DC50B/ 4-Cup Capacity/ Easy-Access, Washable Filter Basket/ Black Finish",$22.00,201959840,"DeLonghi DC50B Twenty Four Seven Drip Coffee Maker, Black",,DeLonghi,$22.95,1
38944,201965217,38944,Panasonic LM-AF30U3 Three Pack Of Single-Sided 30 Minute DVD-RAM Discs - LMAF30U3,"Panasonic LM-AF30U3 Three Pack Of Single-Sided 30 Minute DVD-RAM Discs - LMAF30U3/ Compatible With DVD Camcorder, DVD Video Recorders And DVD-RAM Drives/ Rewritable/ XTRA, Fine And Standard Recording Modes/ 1.4 GB Data Capacity",$8.99,201965217,Panasonic DVD-RAM Media - LM-AF30U3,1.4GB - 3 Pack,Panasonic,$6.22,1
32546,202003159,32546,Belkin Hi-Speed USB 2.0 7-Port Hub - F5U237APLS,Belkin Hi-Speed USB 2.0 7-Port Hub - F5U237APLS/ Transfers Data Up To 480Mbps/ Installs Easily With Plug-And-Play Convenience/ Works Seamlessly With All USB 1.1 And USB 2.0 Devices/ Over-Current Detection And Safety/ Mac And PC Compatible/ Silver Finish,$49.00,202003159,Belkin Hi-Speed USB 2.0 7-Port Hub - F5U237-APL-S,USB 2.0 7-PORT HUB/APPLE #TB857LL/A,Belkin,,1
38106,202026554,38106,Canon Black EF 70-300mm F/4-5.6 IS USM Telephoto Zoom Lens - 0345B002,Canon Black EF 70-300mm F/4-5.6 IS USM Telephoto Zoom Lens - 0345B002/ 15 Elements In 10 Groups Lens Construction/ 4.9 Feet Closest Focusing Distance/ 6-Group Helical Zoom/ 58MM Filter Size/ Black Finish,,202026554,Canon EF 70-300mm f/4-5.6 IS USM Telephoto Zoom Lens - 0345B002,f/4 to 5.6,Canon,$549.00,1
17191,202041195,17191,Universal IR/RF Aeros Remote Control- MX850 - MX850,Universal IR/RF Aeros Remote Control- MX850/ Laser Etched Buttons/ Centrally Located Joystick/ Memory Back-Up/ One Hand Ergonomics/ Controls Up To 20 Components,$399.95,202041195,Universal Aeros IR/RF Remote Control - MX850,"TV, DVD Player, Audio Receivers, Cable Box, Satellite Receiver, PVR (Personal Video Recorder) - 100 ft - Universal Remote","UNIVERSAL REMOTE CONTROL, INC",$256.99,1
17187,202041204,17187,Universal IR/RF Remote - MX350,Universal IR/RF Remote - MX350/ Controls Up To 10 Components/ Extensive Macro Programming/ Memory Back-Up/ One Hand Ergonomics,$149.95,202041204,Universal MX-350 Osiris Remote Control - MX350,"TV, VCR, DVD Player, CD Player, Cable Box, Satellite Receiver, DVR, Audio Receivers - 100 ft - Universal Remote","UNIVERSAL REMOTE CONTROL, INC",$93.90,1
18970,202045862,18970,Panasonic Genius Countertop Microwave In Black - NNH965BK,Panasonic Genius Countertop Microwave - NNH965BK/ 2.2 Cubic Foot/ Inverter Turbo Defrost/ Child Safety Lock/ Versatile Function Key/ Black Finish/,,202045862,Panasonic NN-H965BF Microwave Oven - Counter Top - 2.2ft - 1250W - Black,,Panasonic,,1
18516,202045875,18516,Panasonic Genius Countertop Microwave In White - NNH965WH,Panasonic Genius Countertop White Microwave - NNH965WH/ 2.2 Cubic Foot/ Inverter Turbo Defrost/ Child Safety Lock/ Versatile Function Key/ White Finish,,202045875,Panasonic NN-H965WF Luxury Full-Size 2-1/5-Cubic-Foot 1250-Watt Microwave Oven- White,,Panasonic,,1
30957,202046565,30957,Linksys Wireless-G Broadband Router - WRT54GL,Linksys Wireless-G Broadband Router - WRT54GL/ All-In-One Internet-Sharing Router/ 4-Port Switch/ Push Button Setup Feature/ TKIP And AES Encryption/ Wireless MAC Address Filtering/ Powerful SPI Firewall/ 54Mbps Wireless-G (802.11g) Access Point,$79.00,202046565,Linksys Wireless-G WRT54GL Broadband Router,Linksys WRT54GL Wireless-G Broadband Router,LINKSYS,,1
25318,202049393,25318,Terk XM Outdoor Home Antenna - Grey Finish - XM6,"Terk XM Outdoor Home Antenna - XM6/ Universal Mounting Roof, Wall Or Mast/ For Use With Single-Input Receivers/ Connects RG6 Cable For Easy Routing Up To 100 Ft. (Optimal Disatnce 75 Ft.)",$80.00,202049393,Audiovox XM6 Outdoor Home Antenna - XM-6,,Terk Technologies,,1
18960,202067544,18960,Nikon AF Speedlight Accessory - SB600,Nikon AF Speedlight Accessory - SB600/ Versatile Remote Speedlight/ i-TTL Flash Control/ FV Lock (Flash Value Lock)/ Auto FP High Speed Sync Mode,,202067544,Nikon Speedlight SB-600 AF Flash Light - 4802,"i-TTL, TTL, D-TTL, Manual - 65.6ft Range",Nikon,$189.72,1
29273,202070807,29273,Kensington MicroSaver Keyed Notebook Lock - 64068F,Kensington MicroSaver Keyed Notebook Lock - 64068F/ Steel Composite Cable With Carbon Tempered Steel Core/ Built-In Defense System/ T-Bar Lock/ Easy To Install,,202070807,Kensington MicroSaver Notebook Lock - 64068F,Steel - 6ft,Kensington,,1
38455,202104453,38455,Linksys Compact Wireless-G USB Adapter - WUSB54GC,Linksys Compact Wireless-G USB Adapter - WUSB54GC/ Connects Your Desktop Or Notebook To A Wireless Network At Up To 54Mbps When Used With A USB 2.0 Port/ Compatible With Wireless-B Networks (At 11Mbps)/ Protected By WPA and Up To 128-Bit Data Encryption,$39.00,202104453,Linksys Wireless-G WUSB54GC Compact USB Adapter,,LINKSYS,,1
28963,202106724,28963,Sirius External Home Antenna - 14240,Sirius External Home Antenna - 14240/ Adjustable Design/ Durable UV-Coated Weather Resistant Construction/ Included Is A 30 Cable And Complete Mounting Hardware/ Compatible With Single Input SIRIUS Home Tuners And Plug & Play Receivers,,202106724,Sirius Outdoor Home Antenna - 14240,42 dBi - SMB,Sirius,,1
26563,202125720,26563,Sony Digital Photo Printer Paper 120 Pack - SVMF120P,Sony Digital Photo Printer Paper 120 Pack - SVMF120P/ 4' x 6' Print Paper With Snap-Off Edges/ Super Coat 2 Protective Lamination/ Water Damage And Fingerprint Resistant Prints/ 120 Sheets Of Paper And Print Ribbon/ For DPPF Series Digital Photo Printers Only,$35.00,202125720,Sony Ribbon and Paper with Snap-Off Edges For DPP-FP50 Digital Photo Printer - SVMF120P,"Ribbon, Sheet",Sony,,1
22798,202143942,22798,Sanus VMAV Black VisionMount Component Wall Shelf VMAVB In Black - VMAVB,Sanus VMAV Black VisionMount Component Wall Shelf - VMAVB/ Single Wall Mount Shelf For Audio-Video Component/ Metal V Arm/ Black Finish,$34.99,202143942,Sanus VCD/DVD Wall Mount - VMAVB,,Sanus,,1
22042,202145734,22042,Logitech Harmony 890 Advanced Universal Remote Control - H890,Logitech Harmony 890 Advanced Universal Remote Control - H890/ Quick And Simple Set Up/ Advanced Online Setup And Update Wizard/ Uses Both Radio Frequency (RF) And Infrared (IR) Wireless Signals/ Integrate Up To 15 Devices/ 8 On-Screen Activity Buttons/ Rechargeable Lithium Ion Battery And Charging Station Included/ Fully Backlit/ Comfort-Grip Shape,,202145734,Logitech Harmony 890 Advanced Universal Remote - 966193-0403,,Logitech,$248.90,1
22042,202238311,22042,Logitech Harmony 890 Advanced Universal Remote Control - H890,Logitech Harmony 890 Advanced Universal Remote Control - H890/ Quick And Simple Set Up/ Advanced Online Setup And Update Wizard/ Uses Both Radio Frequency (RF) And Infrared (IR) Wireless Signals/ Integrate Up To 15 Devices/ 8 On-Screen Activity Buttons/ Rechargeable Lithium Ion Battery And Charging Station Included/ Fully Backlit/ Comfort-Grip Shape,,202238311,"Logitech Harmony 890 Advanced Universal Remote - HDTV, TV, DVD Player(s), Lighting, Audio System - 100 ft - Universal Remote - 966193-0403",,Logitech,$335.11,1
