idAbt,idBuy,id_abt,name_abt,description_abt,price_abt,id_buy,name_buy,description_buy,manufacturer,price_buy,is_match
37648,206928384,37648,Canon Printer Gray Ink Cartridge - CLI221GRY,"Canon Printer Gray Ink Cartridge - CLI221GRY/ FINE Technology For Exceptional Sharpness And Detail/ Compatible With PIXMA iP3600, PIXMA iP4600, PIXMA MP620 And PIXMA MP980",,206928384,Canon PowerShot SD1100 IS Digital ELPH Camera - Swing Silver - 2508B001,"Canon PowerShot SD1100 IS 8 Megapixels, ISO 1600, 3x Optical Zoom Digital Camera - Swing Silver",Canon,,0
36118,207388759,36118,Griffin iPod DirectDeck Universal Cassette Adapter - 7256DDECK,"Griffin iPod DirectDeck Universal Cassette Adapter - 7256DDECK/ Plug The Audio Jack Into The Headphone Port Of Your iPod, Mp3 Player, CD Player Or Other Portable Audio Device And Insert The Cassette Adapter Into Your Cassette Player/ Black Finish",,207388759,Panasonic Viera TH-46PZ80U 46' Plasma TV,"46' - ATSC, NTSC - 16:9 - 1920 x 1080 - Surround - HDTV",Panasonic,"$1,249.94",0
37183,208456233,37183,Apple 32GB Black 2nd Generation iPod Touch - MB533LLA,"Apple 32GB Black 2nd Generation iPod Touch - MB533LLA/ Holds Up To 7,000 Songs In 128-Kbps AAC Format, 25,000 iPod-Viewable Photos And 40 Hours Of Video/ Wi-Fi (802.11b/g)/ Nike + iPod Support Built-In/ Maps Location-Based Service/ 3.5' (Diagonal) Widescreen Multi-Touch Display/ 480x320-Pixel Resolution/ 480p And 576p Component TV Out/ Mac And Windows Compatible/ Black Finish",$399.00,208456233,Whirlpool WTW6700TW 28' Cabrio Series Top Loader Washer (Metallic/White),,Whirlpool,$925.91,0
18960,10373002,18960,Nikon AF Speedlight Accessory - SB600,Nikon AF Speedlight Accessory - SB600/ Versatile Remote Speedlight/ i-TTL Flash Control/ FV Lock (Flash Value Lock)/ Auto FP High Speed Sync Mode,,10373002,Sony VAIO Notebook and AC Adapter Case - VGPAMC2,VAIO NEOPRENE NOTEBOOK & AC ADAPTER CASE UP TO 17 IN LCD,Sony,,0
33275,204154429,33275,Canon Vixia High Definition Camcorder - HV30,Canon Vixia High Definition Camcorder - HV30/  2.7' Color Widescreen LCD/ 10x HD Video Zoom Lens/ 2.96 Megapixel/ DIGIC DV II Image Processor/ 200x Digital Zoom/ Built-In Ultra Video Light/ MiniSD Card Slot/ Built-In Electronic Lens Cover,,204154429,Coby Electronics TF-DVD7006 Portable DVD Player - TFDVD7006,Coby TF-DVD7006 7' Widescreen Portable DVD Player,Coby,$70.32,0
37308,207390673,37308,Sony VAIO CS Series Pink Notebook Computer - VGNCS180JP,Sony VAIO CS Series Pink Notebook Computer - VGNCS180JP/ 2.26GHz Intel Core 2 Duo Processor P8400/ 14.1' (1280 x 800) XBRITE-ECO Widescreen Display/ 320GB Serial ATA 5400rpm Hard Drive/ Built-In 1.3 Megapixel MOTION EYE Camera And Microphone/ 4GB PC2-6400 (2GBx2) Installed Memory/ Integrated Stereo A2DP Bluetooth/ 1066MHz Front Side Bus Speed/ 3MB L2 Cache/ Blu-ray Drive (Read Only)/ Genuine Microsoft Windows Vista Home Premium 64-Bit/ Pink Finish,,207390673,Panasonic Lumix DMC-TZ5 Digital Camera - Black,"Panasonic Lumix DMC-TZ5K 9 Megapixel Digital Camera with 28mm Wide-Angle Lens, 10x Optical Zoom, 3' LCD and HD Output - Black",Panasonic,,0
36286,10011646,36286,Toshiba XDE Black 1080p Upconversion Extended Detail DVD Player - XDE500,Toshiba XDE Black 1080p Upconversion Extended Detail DVD Player - XDE500/ Full 1080p Upconversion With 24 Frames Per Second/ Detail Enhancement/ Intelligent Color/ Contrast Enhancement/ DivX Certified/ Black Finish,$99.00,10011646,Linksys EtherFast EZXS88W Ethernet Switch - EZXS88W,Linksys EtherFast 8-Port 10/100 Switch (New/Workgroup),LINKSYS,,0
17372,206678505,17372,Belkin AC Anywhere - F5C400300W,Belkin AC Anywhere - F5C400300W/ Mobile Power Adapter For Your Vehicle/ Powers Portable Devices Using A 300-Watt Power Inverter/ 2 AC Outlets/ Converts DC Power To AC Power From A Cigarette Lighter Socket/ Automatic Overheat Shut-Off/ Low-Battery Alarm/ Overload Protection/ Replaceable Fuse Included/ Power LED Indicator,,206678505,MONSTER A IP FM-CH 250 iCarPlay Wireless 250 FM Transmitter for iPod & iPhone - AIPFM-CH250,,Monster,,0
20454,90148258,20454,Canon Magenta Ink Tank - Magenta - CLI8M,"Canon Magenta Ink Tank - CLI8M/ Compatible With The Pixma iP4200, iP5200, iP5200R, iP6600D, MP500, MP800 Printers",$16.00,90148258,OmniMount TV Top Shelf Mount - CCH1P,Steel - 30 lb,"OMNIMOUNT SYSTEMS, INC",,0
38173,90145568,38173,Panasonic DECT 6.0 2-Line Digital Expandable Corded/Cordless Phone System - KXTG9391T,Panasonic DECT 6.0 2-Line Digital Expandable Corded/Cordless Phone System - KXTG9391T/ DECT 6.0 Digital Technology (1.9 GHz Frequency)/ Expandable Up To 6 Total Handsets/ Wifi Friendly/ Digital Answering System/ 50 Number Caller ID Memory/ 100 Number Phonebook/ Digital Speakerphone On Handset And Base/ Light-Up Indicator With Ringer Alert/ White Backlit 3-Line LCD/ Black Finish,$179.00,90145568,Sanus Under Cabinet LCD TV Mount - VMUC1S,15 lb,Sanus,,0
34004,210401451,34004,Samsung 52' Series 5 LCD Black Flat Panel HDTV - LN52A550,"Samsung 52' Series 5 LCD Black Flat Panel HDTV - LN52A550/ Full 1080p High Definition Resolution/ 16:9 Widescreen Aspect Ratio/ 30,000:1 Dynamic Contrast Ratio/ 5ms Response Time/ SRS TruSurround XT Audio/ Built-In Digital Tuner (ATSC/Clear QAM)/ Picture-In-Picture/ Sound Leveler/ 3 HDMI Slots/ Swivel Stand/ Black Finish",,210401451,Apple MacBook Pro Notebook - MB470LL/A,"Intel Core 2 Duo 2.4GHz - 15.4' WXGA+ - 2GB DDR3 SDRAM - 250GB HDD - DVD-Writer (DVDR/RW) - Gigabit Ethernet, Wi-Fi, Bluetooth - Mac OS X 10.5 Leopard",Apple,"$1,849.00",0
31596,90145584,31596,Nikon VR 55-200MM Zoom-Nikkor Lens Accessory - 2166,Nikon VR 55-200MM Zoom-Nikkor Lens Accessory - 2166/ 3.6X Zoom/ 55 - 200MM/ Vibration Reduction/ Silent Wave Motor For Quiet Autofocusing/ ED Glass Element,,90145584,Sanus Flat Panel TV Wall Mount - VM400B,"Steel, Aluminum - 80 lb",Sanus,,0
32584,207390710,32584,Panasonic PT-AX200U White Home Theater Projector - PTAX200,"Panasonic PT-AX200U White Home Theater Projector - PTAX200/ 2,000-Lumen Brightness/ Pure Color Filter/ Dynamic Iris/ Smooth Screen Technology/ Advanced Dynamic Sharpness Control/ 6,000:1 Contrast Ratio/ 1280 x 720 Pixels (1920 x 1080 Pixels With Compression)/ White Finish",,207390710,Sony alpha DSLR-A350K Digital SLR Camera with 18-70mm Zoom Lens - Black - DSLRA350K,14.2 Megapixel - 3.9x Optical Zoom - 2.7' Active Matrix TFT Color LCD,Sony,$686.24,0
32579,204254738,32579,Netgear Wireless Access Point - WG102,"Netgear Wireless Access Point - WG102/ High-Speed IEEE 802.11g, Up To 108 Mbps In Turbo Mode/ Wi-Fi Protected Access (WPA 802.11i-Ready Security)/ Integrated IEEE 802.3af Power Over Ethernet (PoE)/ Block SSID Broadcast/ VPN Pass-Through Support",$186.00,204254738,Sony DVPNS57P DVD Player - DVPNS57PS,"DVD-R, DVD+R, DVD+RW, DVD-RW, CD-RW - DVD Video, SVCD, Video CD, JPEG, MP3 Playback - 1 Disc(s) - Progressive Scan - Silver",Sony,$45.32,0
21554,205593354,21554,Yamaha High Performance Subwoofer -  Black Finish - YSTFSW100BK,Yamaha High Performance Subwoofer - YSTFSW100BK/ 130 Watts Dynamic Power/ Advanced YST II (Yamaha Active Servo Technology)/ Half Pipe Port/ Powerful 6.5? Multi-Range Driver/ Magnetically Shielded/ 16Hz Ultra Low Frequency Reproduction/ Slim Design/ Black Finish,$150.00,205593354,Denon AVR-3808CI A/V Receiver - AVR3808CI,"Dolby Pro Logic IIx, Dolby Digital Surround, DTS-ES, DTS Neo:6, DTS 96/24, Neural SurroundFM, AM, XM",Denon,"$1,698.00",0
19141,206808432,19141,Sanus Universal Projector Ceiling Mount -  Black Finish - VMPR1B,Sanus Universal Projector Ceiling Mount - VMPR1B/ Designed For DLP And LCD Projectors/ Quick Release Mechanism/ 50 Lbs Capacity/ Black Finish,$129.99,206808432,Canon DC320 Digital Camcorder - 2691B001,Canon DC320 DVD Digital Camcorder,Canon,$299.99,0
28180,205561996,28180,Microsoft Office Home And Student 2007 For Windows Vista - 79G00007,"Microsoft Office Home And Student 2007 For Windows Vista- 79G00007/ Included Excel 2007, OneNote 2007, PowerPoint 2007, Word 2007/ Results-Oriented User Interface/ SmartArt Diagramming And Enhanced Charting Capabilities/ Enhanced Reliability And Security Features/ Document Inspector",,205561996,Peerless SmartMount 700 Series Articulating Wall Arm,Peerless SA745PU - Articulating Wall Arm for 32' to 45' LCD and Plasma Screens - Piano Black,Peerless,,0
37810,209245965,37810,Sony VAIO LV Series Silver All-In-One Desktop Computer - VGCLV140J,Sony VAIO LV Series Silver All-In-One Desktop Computer - VGCLV140J/ 2.53GHz Intel Core 2 Duo E7200 Processor/ 4GB Memory/ Built-In 1.3 MP MOTION EYE Camera And Microphone/ 320GB Serial ATA Hard Drive/ 24' XBRITE-Full HD LCD/ Integrated Stereo A2DP Bluetooth Technology/ Two Built-In 5.5 Watt Stereo Speakers/ Microsoft Windows Vista Home Premium 64-Bit/ Silver Finish,,209245965,Sony VAIO AW110J/H Notebook - VGNAW110J/H,"Sony Vaio AW Series AW110JH Notebook 2.26GHz Intel Core 2 Duo P8400, 4GB RAM, 320GB Hard Drive, DVD +/- RW w/ Blu-ray Disc Support, Wireless 802.11a/b/g/n, NVIDIA GeForce 9300M, 18.4' XBRITE-ECO LCD Display, Webcam & Mic, Windows Vista Home Premium",Sony,,0
9314,205599984,9314,Panasonic Hands Free Headset  - KXTCA92,Panasonic Hands Free Headset - KXTCA92/ Comfort Fit With Fold Design/ Noise Cancelling Microphone/ Volume Control/ Mute/ Standard 2.5mm Connection,$25.00,205599984,Canon EOS 40D Digital SLR Camera - 1901B004,Canon EOS 40D 10 Megapixel Digital SLR Camera - Body Only,Canon,$849.95,0
34548,203142471,34548,Sony White Earbud Style Headphones - MDREX55WH,Sony MDREX55WHI White Earbud Style Headphones - MDREX55WH/ 9mm EX Driver Provides Comfort Fit And Deep Bass Sound/ Soft Fitting Silicon Housing/ 3 Sizes Earbuds/ Carrying Pouch/ White Finish,,203142471,DIRECTDECK UNIVERSAL CASSETTE ADAPTER FOR MP3 PLAYERS - 7256-DDECK,,Griffin,,0
29338,206576716,29338,Sony Memory Stick USB Adaptor - MSACUS40,Sony Memory Stick USB Adaptor - MSACUS40/ Quickly Transfer Image And Data To A PC/ Transfer Speed Up To 80Mbps/ Compatible With All Memory Stick Media,$29.00,206576716,Linksys Wireless-G Internet Video Camera - WVC54GCA,"CMOS - Wireless Wi-Fi, Wireless Wi-Fi, Cable, Cable",LINKSYS,,0
32630,203491687,32630,Apple 1TB Time Capsule Wireless Hard Drive  - MB277LLA,Apple 1TB Time Capsule Wireless Hard Drive - MB277LLA/ 1TB 7200-rpm Serial ATA Server-Grade Hard Disk Drive/ Up To 5x The Performance And 2x The Range With 802.11n/ Wi-Fi Protected Access (WPA/WPA2)/ Wireless Security (WEP) Configurable For 40-Bit And 128-Bit Encryption/ NAT Firewall/ AirPort Utility For Mac And Windows,$499.00,203491687,Waring Pro Deep Fryer 3qt -Black,,Waring,,0
35800,206783256,35800,Panasonic Expandable Bluetooth-Enabled DECT 6.0 Phone System - KXTH1212B,Panasonic Expandable Bluetooth-Enabled DECT 6.0 Phone System - KXTH1212B/ Call Waiting Caller ID/ White Backlit Color LCD/ Lighted Handset Keypad/ Night Mode/ Compatible With Most Bluetooth Cell Phones/ 5 Hours Talk Time/11 Days Standby Time/ 60 Channels/ Black Finish,,206783256,LaCie Little Disk Hard Drive - 301829,LaCie 320GB Little Disk USB 2.0 5400RPM Portable External Hard Drive,LACIE,,0
32314,203324914,32314,Altec Lansing Orbit-MP3 Portable Audio System - IM207,Altec Lansing Orbit-MP3 Portable Audio System - IM207/ Fusion360 Technology/ Plays For Up To 24 Hours On 3 AAA Batteries/ Shock-Resistant/ Personal Configuration,,203324914,OmniMount MWFS Moda Collection 2 Shelf Wall Mounted Furniture System - Espresso,,"OMNIMOUNT SYSTEMS, INC",$158.16,0
38477,208114664,38477,Linksys EtherFast 8-Port 10/100 Switch - EZXS88W,Linksys EtherFast 8-Port 10/100 Switch - EZXS88W/ 10/100 Dual-Speed Per-Port/ Perfect For Optimizing 10BaseT And 100BaseTX Hardware On The Same Network/ Speeds Of Up To 200Mbps In Full Duplex Operation/ Eliminate Bandwidth Constraints And Clear Up Bottlenecks,$44.00,208114664,LG 22 Cu.Ft. Total Capacity,,LG Electronics,,0
34881,203514371,34881,Sony 32' BRAVIA L-Series Black LCD Flat Panel HDTV - KDL32L4000,"Sony 32' BRAVIA L-Series Black LCD Flat Panel HDTV - KDL32L4000/ 1366 x 768 Resolution/ Up To 1080/60p Input Capable Via HDMI/ ATSC/NTSC Tuner With QAM/ 2,000:1 Contrast Ratio/ CineMotion Reverse 3:2 Pulldown Technology/ 3D Digital Comb Filter/ VESA Hole Spacing Compatible/ Black Finish",,203514371,Linksys WPSM54G Wireless-G USB Print Server,"1 x 10/100Base-TX Network, 1 x USB - Wi-Fi - IEEE 802.11b/g",LINKSYS,,0
30203,208296017,30203,Denon X-Space Surround Bar Home Theatre System In Black - DHTFS3,"Denon X-Space Surround Bar Home Theatre System In Black - DHTFS3/ 22 Watts x 5 (6 Ohms)/ Supports All Audio Formats (Dolby Digital, DTS, Dolby Pro Logic II)/ Slim Design/ Includes Dolby Headphones/ Included Subwoofer Features One-Touch Connection/ Remote Control/ Black Finish","$1,199.00",208296017,Samsung HT-X710 Bluetooth 400-Watt Home Theater System With iPod Dock,,Samsung,,0
33536,209720586,33536,Elgato TV Receiver And Video Converter For Analog & Digital TV - 10020780,Elgato TV Receiver And Video Converter For Analog & Digital TV - 10020780/ Built-In Hardware Encoder Compresses Audio And Video Signals To MPEG-1 And MPEG-2 Formats/ Convert Analog VHS Tapes Into Digital Files,,209720586,Coby Electronics TF-TV1514 15' LCD TV,"15' - Active Matrix TFT - ATSC, NTSC - 16:9 - 1280 x 800 - HDTV",Coby,$149.99,0
25902,207552185,25902,Lowepro Digital Camera Case In Black - REZO15BK,"Lowepro Rezo 15 Digital Camera Case In Black - REZO15BK/ Slim, Sleek Little Pouch/ Stretchy Side Gussets/ Pocket For Memory Card/ Adjustable Shoulder Strap/ Water-Resistant Microfiber",,207552185,Olympus EVOLT E-420 Digital SLR Camera With 14 - 42mm f/3.5-f/5.6 Zuiko Digital Zoom Lens - Black - 262081,"Olympus EVOLT E-420 10 Megapixel Digital SLR Camera with 14-42MM Outfit, Autofocus, Live View, Face Detection & Dust Reduction",Olympus,$403.72,0
34858,203022202,34858,Sony 26' BRAVIA M-Series Black LCD Flat Panel HDTV - KDL26M4000,"Sony 26' BRAVIA M-Series Black LCD Flat Panel HDTV - KDL26M4000/ 1366 x 768p Resolution/ Advanced Contrast Enhancer Circuit (ACE)/ BRAVIA Engine Fully Digital Video Processor/ ATSC/NTSC Tuner With QAM/ 9,000:1 Dynamic Contrast Ratio/ 3D Comb Filter/ Black Finish",,203022202,Pioneer Car Audio Remote Control - CDVC1,Car Audio System - Car Audio Remote,Pioneer,$35.00,0
35219,205083968,35219,Sony 46' BRAVIA Z Series Black LCD Flat Panel HDTV - KDL46Z4100B,Sony 46' BRAVIA Z Series Black LCD Flat Panel HDTV - KDL46Z4100B/ 1920 x 1080 Full HD 1080p Resolution/ Digital Media Extender (DMex)/ BRAVIA Engine Technology/ Advanced Contrast Enhancer (ACE)/ Enhanced (XMB) User Interface With Rich 3D Graphics/ 24p True Cinema/ Black Finish,,205083968,UNIDEN DCX200 DECT 6.0 Accessory Handset & Charger,,Uniden,,0
25291,202900002,25291,Sirius Sportster 4 With Car Kit - SP4TK1,Sirius Sportster 4 With Car Kit - SP4TK1/ Replays 44 Minutes Of Content/ Large Easy-To-Read 6-Line Display/ 30 Channel Presets/ Game Alerts And Game Zone Features/ One Touch Jump,,202900002,Panasonic BL-C1A Network Camera,,Panasonic,,0
36033,206928388,36033,Canon Black Leather Camera Case - 1588B001,Canon Black Leather Camera Case - 1588B001/ Compatible With Canon Digital ELPH Cameras/ Protects Your Camera From Dust And Scratches/ Wrist Strap For Easy Portability/ Black Finish,,206928388,Canon PowerShot SD1100 IS Digital ELPH Camera - Melody Pink - 2509B001,"Canon PowerShot SD1100 IS 8 Megapixels, ISO 1600, 3x Optical Zoom Digital Camera - Pink Melody",Canon,,0
25291,208504179,25291,Sirius Sportster 4 With Car Kit - SP4TK1,Sirius Sportster 4 With Car Kit - SP4TK1/ Replays 44 Minutes Of Content/ Large Easy-To-Read 6-Line Display/ 30 Channel Presets/ Game Alerts And Game Zone Features/ One Touch Jump,,208504179,Denon DVD-3800BDCI Blu-ray Disc Player - DVD3800BDCI,"BD-R, DVD-RW, CD-RW, Secure Digital (SD) - DVD Video, CD-DA, MP3, WMA, JPEG, DivX 6, PCM Playback - Progressive Scan",Denon,,0
34009,208890628,34009,Samsung 46' Series 6 LCD Black Flat Panel HDTV - LN46A650,"Samsung 46' Series 6 LCD Black Flat Panel HDTV - LN46A650/ Full 1080p High Definition Resolution/ 16:9 Widescreen Aspect Ratio/ 50,000:1 Dynamic Contrast Ratio/ 4ms Response Time And Auto Motion Plus 120Hz Technology/ SRS TruSurround XT Audio/ Built-In Digital Tuner (ATSC/Clear QAM)/ Picture-In-Picture/ Auto Volume Leveler/ 4 HDMI Slots/ Swivel Stand/ Piano Black With Hint Amber Finish",,208890628,"Logitech diNovo Edge, Mac Edition - 920-000924",,Logitech,,0
33924,203472622,33924,Panasonic Black DVD Home Theater Sound System - SCPT960,Panasonic Black DVD Home Theater Sound System - SCPT960/ Kelton Subwoofer/ Bamboo Diaphragm Center Speakers/ 1080p Up-Conversion/ Integrated Universal Dock And On-Screen Display For iPod/ iPod Video Playback/ Wireless Rear Speaker System/ Whisper-Mode Surround/ Built-In Dolby Digital And DTS Decoder/ High Speed 5-DVD/CD Changer/ Black Finish,,203472622,Panasonic KX-FP145 Plain Paper Thermal Transfer Fax/Copier - KXFP145,Panasonic Slim Cabinet Plain Paper Fax/Copier with All-digital Answering System,Panasonic,$94.88,0
30841,208504378,30841,Skagen Premium Steel Slimline Mesh Womens Watch - 233XSGG,Skagen Premium Steel Slimline Mesh Womens Watch - 233XSGG/ Stainless Steel Mesh Band/ Elegant Round Case/ Mother-Of-Pearl Dial/ Chrome Indicators,$110.00,208504378,LG 32LG40 32' TV/DVD Combo,"LG 32LG40 - 32' Widescreen 720p LCD HDTV w/ Built-in DVD Player - 12,000:1 Dynamic Contrast Ratio - 8ms Response Time",LG Electronics,,0
37322,207514568,37322,Sony VAIO NS Series Silver Notebook Computer - VGNNS190JS,Sony VAIO NS Series Silver Notebook Computer - VGNNS190JS/ 2.0GHz Intel Core 2 Duo Processor T5800/ 15.4' (1280 x 800) XBRITE-ECO Widescreen Display/ 250GB Serial ATA 5400rpm Hard Drive/ Built-In 1.3 Megapixel MOTION EYE Camera And Microphone/ 4GB PC2-6400 (2GBx2) Installed Memory/ 800MHz Front Side Bus Speed/ 2MB L2 Cache/ Genuine Microsoft Windows Vista Home Premium 64-Bit/ Blu-ray Drive (Read Only)/ Silver Finish,,207514568,Sony VCT-80AV Tripod - VCT80AV,Floor Standing Tripod - 24.8' to 65.75' Height - 8.8 lb Load Capacity,Sony,,0
35334,208504423,35334,Mitsubishi 835 Diamond Series 73' 1080p DLP Rear Projection HDTV - WD73835,Mitsubishi 835 Diamond Series 73' 1080p DLP Rear Projection HDTV - WD73835/ 1920 x 1080 Full HD Resolution/ 6-Color Processor/ Smooth 120Hz/ x.v.Color/ Plush1080p 12-Bit Digital Video Processing/ Color 4D Video Noise Reduction/ 3D Ready/ NetCommand/ DeepField Imager/ Black Finish,"$3,499.00",208504423,Sony STR-DG920 A/V Receiver - STRDG920,"Dolby Digital, Dolby Pro Logic II, DTS 96/24, DTS Neo:6, Dolby Digital EX, Dolby Pro Logic IIx, Dolby Pro Logic, DTS-ES, Digital Cinema Sound, DTSFM, AM, XM",Sony,$404.07,0
34256,207539418,34256,Weber Cast Iron Griddle - 7531,Weber Cast Iron Griddle - 7531/ Heavy-Duty Cast Iron Griddle/ Fits Weber Genesis Silver A & Spirit 500 Gas Grills,$44.99,207539418,Samsung L200 Digital Camera - Black - EC-L200ZBBA/US,"Samsung L200 10 Megapixel Digital Camera with 2.5 LCD, 3x Optical Zoom, Digital Image Stabilization, Face Detection Function - Black",Samsung,$119.00,0
33955,205865183,33955,Panasonic Black 1080p Up-Conversion DVD Recorder And VHS Combo Player - DMREZ48VK,Panasonic Black 1080p Up-Conversion DVD Recorder And VHS Combo Player - DMREZ48VK/ Digital Tuner And 1080p Up-Conversion/ Simple Recording And Playback With VIERA Link/ Digital Camera Connection With SD Memory Card And USB Cable/ Super Multi Format Recording And Playback/ One Touch 2 Way Copying/ DivX Playback/ Auto Drive Select/ Black Finish,,205865183,Transcend 4GB CompactFlash Card (133x) - TS4GCF133,Transcend 4GB CompactFlash Memory Card (133x),TRANSCEND INFORMATION,,0
25902,208504369,25902,Lowepro Digital Camera Case In Black - REZO15BK,"Lowepro Rezo 15 Digital Camera Case In Black - REZO15BK/ Slim, Sleek Little Pouch/ Stretchy Side Gussets/ Pocket For Memory Card/ Adjustable Shoulder Strap/ Water-Resistant Microfiber",,208504369,LG 52LG50 52' LCD TV,"LG 52LG50 - 52' Widescreen 1080p LCD HDTV - 15,000:1 Dynamic Contrast Ratio - 6ms Response Time",LG Electronics,,0
37208,208111904,37208,Apple 120GB Silver 7th Generation iPod Classic - MB562LLA,"Apple 120GB Silver 7th Generation iPod Classic - MB562LLA/ Holds Up To 30,000 Songs In 128-Kbps AAC Format, 25,000 iPod-Viewable Photos And 150 Hours Of Video/ 2.5' (Diagonal) Color LCD With LED Backlight/ 320-By-240-Pixel Resolution/ Mac And Windows Compatible/ Silver Finish",,208111904,Panasonic SC-PT960 Home Theater System,"Panasonic SC-PT960 5-Disc DVD Home Theater System with Kelton Subwoofer, 1080p Up-Conversion, Integrated Universal Dock for iPod, 2 Tower Speakers, Wireless Rear Speaker and VIERA Link",Panasonic,$349.99,0
39175,203017999,39175,Logitech Digital Precision PC Gaming Headset - 981000040,Logitech Digital Precision PC Gaming Headset - 981000040/ Cushioned Open-Air Design/ USB And Analog Connections/ Noise-Canceling Microphone/ In-Line Volume And Mute Controls/ 10 Ft. Cable Length/ PC And Mac Compatible/ Black Finish,$49.00,203017999,Denon TU-1500RD Stereo Radio Tuner - TU1500RD,40,Denon,,0
33219,206460113,33219,Peerless 32' - 50' Articulating Flat Panel TV Black Wall Arm - SA750PU,Peerless 32' - 50' Articulating Flat Panel TV Black Wall Arm - SA750PU/ One-Touch Tilt/ Three Pivot Points/ Up To 10.75' Total Horizontal Adjustment/ Black Finish,,206460113,Yamaha YSP-4000 Digital Sound Projector -- Black - YSP-4000BL,,Yamaha,,0
35306,210566840,35306,Panasonic DECT 6.0 Silver Expandable Digital Cordless Phone System - KXTG9332S,Panasonic DECT 6.0 Silver Expandable Digital Cordless Phone System - KXTG9332S/ 2 Handsets System/ Digital Answering Machine/ Ringer ID/ Talking Caller ID/ Voicemail/ Hold/ Mute/ Clock/ Alarm/ LED Lighting/ Night Mode/ Speakerphone/ Intercom/ 11 Days Standby/ 5 Hours Talk Time/ Silver Finish,,210566840,Sony VAIO FW378J/B Notebook - VGNFW378J/B,"Intel Centrino 2 Core 2 Duo P8600 2.4GHz - 16.4' - 4GB DDR2 SDRAM - 320GB HDD - BD-Reader/DVD-Writer (BD-ROM/DVD-RAM/R/RW) - Wi-Fi, Gigabit Ethernet, Bluetooth - Windows Vista Home Premium x64 - Black",Sony,,0
37796,204559211,37796,Escort Passport 9500IX Radar Detector - 9500IX,Escort Passport 9500IX Radar Detector - 9500IX/ Pre-Loaded With Thousands Of Saftey Camera Locations/ 360 Degree Radar & Laser Protection/ Completely Undetectable To All Detector Scanners/ Variable-Speed Radar Performance/ GPS-Powered Truelock Filter/ AutoLearn Feature/ Speed Alert/ Crystal-Clear Voice Alerts/ 80 LED Matrix Blue Display/ 5 Levels Of Brightness Control/ Black Finish,$503.95,204559211,Panasonic 2.2 cu. ft. Stainless Steel Luxury Full Size Countertop Microwave Oven - NNSD967SS,,Panasonic,,0
23097,204295637,23097,Uniden 5.8GHz Accessory Handset And Charger - TCX905,Uniden 5.8GHz Accessory Handset And Charger - TCX905/ Base Keypad/ Handset Speakerphone/ Caller ID/Call Waiting Deluxe/ DirectLink Technology/ Advanced Phonebook Features/ Trilingual Menu Displays,,204295637,Audiovox VE927 9' TV/DVD Combo,"9' - LCD - ATSC, NTSC - 16:9 - Stereo Sound - HDTV - DVD-R, CD-R, CD-RW",Audiovox,$279.99,0
33452,207934190,33452,Yamaha 7.2 Channel Black Digital Home Theater Receiver - RXV663BK,Yamaha 7.2 Channel Black Digital Home Theater Receiver - RXV663BK/ 4 SCENE Buttons/ XM Ready With XM HD Surround/ SIRIUS Satellite Radio Ready/ YPAO/ iPod Compatibility/ Bluetooth Compatibility/ Multi-Zone Control Compatibility/ On-Screen Display/ Black Finish,$499.00,207934190,Sony STR-DG520 A/V Receiver - STRDG520,"Dolby Digital, Dolby Pro Logic II, Digital Cinema Sound, DTS",Sony,$164.51,0
32226,207652056,32226,LG DLEX7177RM Cherry Red XL Capacity Electric SteamDryer - DLEX7177RD,LG DLEX7177RM Cherry Red XL Capacity Electric SteamDryer - DLEX7177RD/ 7.3 Cu. Ft. Capacity/ Intelligent Electronic Controls With Dual LED Display And Dial-A-Cycle/ Dual Humidity Sensors/ Precise Temperature Control With A Variable Heater/ 4 Way Venting/ Drum Light/ Cherry Red Finish,,207652056,Samsung LN46A550 46' LCD TV,"Samsung LN46A550 - 46' Widescreen 1080p LCD HDTV - 30,000:1 Dynamic Contrast Ratio - 5ms Response Time - Piano Black",Samsung,"$1,143.99",0
29272,204274645,29272,Tech Craft Dark Cherry Veneto Series TV Stand - SWP60,Tech Craft Dark Cherry Veneto Series TV Stand - SWP60/ 60' Wide Credenza For Flat Panel TV?s And DLP?s/ Center Channel Compartment And Storage/ 260 Lbs TV Capacity/ 50 Lbs Shelf Capacity/ Dark Cherry Wood Veneer Finish,$399.00,204274645,Frigidaire Electric Dryer - FEQ332WH 5.7 Cu.Ft. Super Capacity Drum,,Frigidaire,$420.29,0
38231,207509842,38231,Netgear ProSafe 24-Port Gigabit Rackmount Switch With 2 SFP Slots - JGS524F,"Netgear ProSafe 24-Port Gigabit Rackmount Switch - JGS524F/ 24 10/100/1000 Mbps Ports/ Automatic Speed/ Full/Half-Duplex Sensing/ Auto Uplink/ Two Hot-Swappable Small Form Factor Pluggable GBIC Slots/ Up To 48 Gbps Of Switching Capacity/ Compatible With PC, Macintosh, Linux, And Unix Operating Systems",,207509842,Altec Lansing Orbit-MP3 Portable Audio System - IM207,,Altec Lansing,,0
34666,207910214,34666,Panasonic VIERA 50' Plasma Flat Panel Black HDTV - TH50PZ800U,"Panasonic VIERA 50' Plasma Flat Panel Black HDTV - TH50PZ800U/ 1920 x 1080 Full HD Resolution/ One-Sheet Glass Design/ Anti-Reflective Screen/ 4096 Shades of Gradation/ 1,000,000:1 Dynamic Contrast Ratio/ 24p Film Mode/ THX Certified/ VIERA Link/ Deep Color/ x.v.Color/ Digital Comb Filter/ 3D Color Management/ Motion Pattern Noise Reduction/ Black Finish",,207910214,Yamaha RX-V363 Home Theater Receiver - RXV363BL,"500W - Dolby Digital, Dolby Pro Logic II, DTS",Yamaha,$199.00,0
37716,90131741,37716,Sanus 30' - 58' VisionMount Flat Panel TV Black Tilting Wall Mount - LT25B1,Sanus 30' - 58' VisionMount Flat Panel TV Black Tilting Wall Mount - LT25B1/ Lateral Shift Adjustment/ Virtual Axis/ Height and Level Adjustments/ ClickStand/ ClickFit System/ Open Wall Plate/ Black Finish,$199.00,90131741,Sennheiser RS 120 Wireless Hi-fi Headphone - RS120,,Sennheiser,,0
